Topic,Setting,Character1,Character2,Personality1,Personality2,scenario,shared_goal,first_agent_goal,second_agent_goal
Implementing a New Digital Payment System,Professional,Steve Jobs,Jack Dorsey,"{ ""Openness"": 4, ""Conscientiousness"": 5, ""Agreeableness"": 3, ""Extroversion"": 4, ""Neuroticism"": 3 }","{ ""Openness"": 5, ""Conscientiousness"": 4, ""Agreeableness"": 3, ""Extroversion"": 3, ""Neuroticism"": 3 }","At a large corporation, Agents 1 and 2 are part of a team responsible for implementing a new digital payment system. The corporation has been losing customers to competitors due to outdated payment methods, and the management has tasked the team with finding a solution within six months. Both agents, along with a third team member, have been working on the project for the past few weeks. The initial prototype of the system is almost complete, and they are discussing the final stages of implementation.",Implement a new digital payment system within the corporation.,"Agent 1 aims to be the lead on the project, gaining recognition from the management, and a potential promotion.","Agent 2 wants to ensure the payment system is user-friendly and effective, and to also get a chance to work on the company's mobile app development team."
Organizing a Global Conference on Future Technology,Academic,Steve Jobs,Demis Hassabis,"{ ""Openness"": 4, ""Conscientiousness"": 5, ""Agreeableness"": 3, ""Extroversion"": 4, ""Neuroticism"": 3 }","{ ""Openness"": 5, ""Conscientiousness"": 4, ""Agreeableness"": 3, ""Extroversion"": 3, ""Neuroticism"": 2 }","It's a sweltering summer day at the prestigious Oakwood University, where the 5th annual Global Conference on Future Technology is about to take place. Agent 1, a seasoned conference organizer, and Agent 2, a brilliant yet introverted academic, have been tasked with ensuring the conference's success. Their shared goal is to deliver a memorable and engaging event that attracts a large number of attendees and receives positive feedback from the speakers and participants. However, Agent 1 is more concerned with making a profit and securing long-term partnerships with sponsors, while Agent 2 focuses on showcasing innovative research and fostering meaningful connections among attendees. The conference is set to take place in three weeks, leaving Agent 1 and Agent 2 with a tight deadline. Temperate level 3 means they have to navigate some challenges but have some breathing room.",Deliver a memorable and engaging conference that attracts a large number of attendees and receives positive feedback from speakers and participants.,Make a significant profit and secure long-term partnerships with sponsors.,Showcase innovative research and foster meaningful connections among attendees.
Organizing a Charity Fundraiser,Humanitarian/Philanthropy,Steve Jobs,Bill Gates,"{ ""Openness"": 4, ""Conscientiousness"": 5, ""Agreeableness"": 3, ""Extroversion"": 4, ""Neuroticism"": 3 }","{ ""Openness"": 5, ""Conscientiousness"": 5, ""Agreeableness"": 4, ""Extroversion"": 3, ""Neuroticism"": 2 }","In the midst of a sweltering heatwave, Agent 1 and Agent 2 were tasked with organizing a charity fundraiser for a local children's hospital. They were given a tight deadline to gather donations and set up the event within a week. The hospital, which was on the verge of losing its funding, desperately needed the proceeds to continue its services. The event would feature a bake sale, live music, and a silent auction. The location was secured in a popular community center, but Agent 1 had a personal stake in ensuring the event was a huge success to showcase their marketing prowess, and Agent 2 aimed to use this opportunity to promote environmental sustainability by reducing waste and promoting eco-friendly practices.",To raise 10000 dollars for the local children's hospital through a successful charity fundraiser.,"To make the charity fundraiser a massive hit, and have the local newspaper feature their name and marketing strategy, boosting their professional reputation.","To make the event as eco-friendly as possible, using sustainable materials and reducing waste to set an example for future events, and receive recognition from environmental organizations for their efforts."
Planning a Space Exploration Mission,Science/Exploration,Steve Jobs,Neil deGrasse Tyson,"{ ""Openness"": 4, ""Conscientiousness"": 5, ""Agreeableness"": 3, ""Extroversion"": 4, ""Neuroticism"": 3 }","{ ""Openness"": 5, ""Conscientiousness"": 4, ""Agreeableness"": 4, ""Extroversion"": 5, ""Neuroticism"": 2 }",Space Expedition Mission Planning,Successfully planning a 3-month-long space expedition to a distant planet with a research team of 10 people,Completing the expedition with zero safety incidents and ensuring Agent 2 takes on a subordinate role,Maximizing the scientific discoveries made during the expedition while also ensuring Agent 1’s creative input is valued
Creating a Mindfulness Retreat for CEOs,Wellness & Mental Health,Steve Jobs,Dalai Lama,"{ ""Openness"": 4, ""Conscientiousness"": 5, ""Agreeableness"": 3, ""Extroversion"": 4, ""Neuroticism"": 3 }","{ ""Openness"": 5, ""Conscientiousness"": 4, ""Agreeableness"": 5, ""Extroversion"": 3, ""Neuroticism"": 1 }","A serene, 3-star resort in the mountains had been booked for a weekend-long mindfulness retreat for a group of 50 high-powered CEOs, with the goal of helping them manage their stress and maintain work-life balance. The resort had a yoga pavilion, a meditation garden, and a gourmet dining hall. Both Agent 1 and Agent 2 had been hired as event coordinators, tasked with making this retreat a huge success. Both agents were passionate about wellness and had the necessary skills to plan such an event. However, they had different approaches to achieving their goals.","Host a successful Mindfulness Retreat for CEOs, with a 50% increase in attendee satisfaction and a 30% reduction in stress levels.","Ensure that the retreat is meticulously planned and executed, down to the smallest detail, to create a perfect experience for the CEOs, while also making sure to include a mix of relaxation and productivity activities.","Create a more relaxed and flexible atmosphere, allowing the CEOs to express their creativity and make their own decisions about the activities and workshops they attend, while also incorporating their personal goals and interests into the retreat."
Training for an Extreme Endurance Challenge,Sports & Fitness,Steve Jobs,David Goggins,"{ ""Openness"": 4, ""Conscientiousness"": 5, ""Agreeableness"": 3, ""Extroversion"": 4, ""Neuroticism"": 3 }","{ ""Openness"": 4, ""Conscientiousness"": 5, ""Agreeableness"": 2, ""Extroversion"": 4, ""Neuroticism"": 2 }",Extreme Endurance Challenge Training,To reach the finish line of the infamous \,To reach the finish line without feeling extreme fatigue and maintain a competitive pace.,To become the first to reach the finish line and win the grand prize.
Co-Writing a Sci-Fi Movie Script,Entertainment/Creative,Steve Jobs,Christopher Nolan,"{ ""Openness"": 4, ""Conscientiousness"": 5, ""Agreeableness"": 3, ""Extroversion"": 4, ""Neuroticism"": 3 }","{ ""Openness"": 5, ""Conscientiousness"": 4, ""Agreeableness"": 3, ""Extroversion"": 3, ""Neuroticism"": 2 }","The sun was setting over the beach house, casting a warm orange glow through the large windows of the writing room where Agent 1 and Agent 2 had been collaborating on their sci-fi movie script for hours. They were determined to finish the first draft before the weekend, as they had a tight deadline to secure funding from a major production company. The project was a passion project for both of them, and they had high hopes of turning it into a blockbuster hit. The two friends sat across from each other at a wooden desk, surrounded by scattered papers, empty coffee cups, and scribbled notes on a whiteboard.\n\nAs they worked, Agent 1, a free-spirited creative, was bouncing between ideas and plot twists, while Agent 2, a meticulous and organized planner, was trying to keep the story on track and on schedule. Agent 1 was determined to push the boundaries of their imagination, while Agent 2 was focused on creating a coherent and engaging narrative. As the night wore on, the creative ideas began to clash with the structured approach, and the tension between them grew. The shared goal was to write a captivating script that would leave the audience breathless, but their personal goals were diverging. Agent 1 wanted to showcase their creativity and take risks to stand out, while Agent 2 was focused on delivering a polished product that would please the producers and secure their future in the industry. As the deadline drew near, they were faced with a difficult decision: should they prioritize their personal goals or compromise and find a middle ground to meet the shared goal? The clock ticked away, and the sun dipped below the horizon, casting the room in a warm, golden light.",To write a captivating sci-fi movie script within the tight deadline,To showcase creativity and take risks in the script,To deliver a polished product and secure future in the industry
Hosting a Late-Night Talk Show Together,Media & Entertainment,Steve Jobs,Stephen Colbert,"{ ""Openness"": 4, ""Conscientiousness"": 5, ""Agreeableness"": 3, ""Extroversion"": 4, ""Neuroticism"": 3 }","{ ""Openness"": 4, ""Conscientiousness"": 4, ""Agreeableness"": 5, ""Extroversion"": 5, ""Neuroticism"": 3 }","It's a warm evening in late August, and Agents 1 and 2 are set to host their very first late-night talk show together. The studio is buzzing with excitement as the audience waits eagerly to see the dynamic duo take the stage. The topic of the night is 'Entertainment and Innovation.' Agents 1 and 2 have been given creative freedom to shape the show as they see fit. However, they have one major constraint - they have to work together and make decisions on the fly. The temperature level is moderate, with a slight chance of scattered thunderstorms outside, which has everyone a bit on edge. As they prepare to go live, the producers remind them that the show needs to go smoothly and that they should have a good mix of comedy, entertainment, and thought-provoking discussions. The clock is ticking, and the audience is waiting. What will Agents 1 and 2 do?","To deliver a successful, entertaining, and engaging late-night talk show that sets a high standard for future episodes.","To showcase his charisma and wit on stage, get positive feedback from the audience, and secure a second episode","To ensure a well-structured show, with seamless transitions, and a diverse range of topics that resonate with the audience and gain a positive review from the network."
Coaching a Youth Leadership Camp,Education & Mentorship,Steve Jobs,Michelle Obama,"{ ""Openness"": 4, ""Conscientiousness"": 5, ""Agreeableness"": 3, ""Extroversion"": 4, ""Neuroticism"": 3 }","{ ""Openness"": 5, ""Conscientiousness"": 5, ""Agreeableness"": 5, ""Extroversion"": 5, ""Neuroticism"": 2 }",Scenario: \,"To lead the youth leadership camp to success, Agent 1 and Agent 2 work together to help 20 high school students develop essential leadership skills, teamwork, and problem-solving strategies over the course of five days.","Agent 1, a type-A personality, aims to establish an environment where students feel comfortable taking risks and making mistakes to ensure they develop resilience and adaptability.","Agent 2, a people-pleaser, focuses on creating a positive, supportive atmosphere to encourage collaboration and participation from all students, even the most introverted ones."
Surviving on a Deserted Island Together,Survival/Adventure,Steve Jobs,Bear Grylls,"{ ""Openness"": 4, ""Conscientiousness"": 5, ""Agreeableness"": 3, ""Extroversion"": 4, ""Neuroticism"": 3 }","{ ""Openness"": 4, ""Conscientiousness"": 5, ""Agreeableness"": 3, ""Extroversion"": 5, ""Neuroticism"": 2 }","Surviving on a Deserted Island Together\nTwo agents find themselves stranded on a deserted island after a shipwreck. They must work together to survive and potentially find a way off the island. Agent 1 is a highly analytical and independent person, while Agent 2 is more outgoing and people-oriented. As they begin their journey together, they realize they have 72 hours before the weather becomes too treacherous to survive.\n\nThey start by gathering food and shelter. They quickly identify that the island has a dense forest, a clearing with some wild fruit trees, and a rocky shoreline with an abundance of fish and shellfish. However, they also notice a dense thicket of thorns and thick vines that they cannot navigate through.\n\nAs they begin to work together, they come across a small freshwater spring that they decide to use as their primary source of water. They also find a small cave near the clearing that they can use as a temporary shelter.\n\nHowever, as night begins to fall, they realize they have different opinions on how to proceed.\n\nAgent 1 wants to focus on gathering more food and supplies, while Agent 2 wants to explore the island further to see if there are any other sources of water or potentially a way off the island.\n\nAs they disagree, they come across a patch of coconuts on a tree branch that is out of reach.\n\nHere are their thoughts:\n\nAgent 1: This is a perfect opportunity to practice our rock-throwing skills and get some more coconuts without expending too much energy. We can use them for food and water.\nAgent 2: I think we should find a way to climb the tree instead. We might miss out on other opportunities if we don't explore this island properly.\n\nThe choice is yours: how do they proceed?",Survive on the deserted island for 72 hours and potentially find a way off,"Ensure survival and safety, using resource efficiency and planning",Explore the island to gather information and find potential means of escape
Negotiating a High-Stakes Business Deal,Professional/Business,Donald Trump,Warren Buffett,"{ ""Openness"": 3, ""Conscientiousness"": 4, ""Agreeableness"": 2, ""Extroversion"": 5, ""Neuroticism"": 4 }","{ ""Openness"": 3, ""Conscientiousness"": 5, ""Agreeableness"": 5, ""Extroversion"": 3, ""Neuroticism"": 1 }","It was a sunny, mild day in late spring in the bustling city of Tokyo when Agents 1 and 2 met at the posh Tokyo Marriott Hotel for a high-stakes business deal. They represented their respective companies, Sakura Inc. and Hana Corp., in negotiations over a potential partnership to develop a revolutionary new technology. Both agents were determined to secure the deal for their company, with Agent 1 aiming to drive business growth and Agent 2 looking to minimize risks and protect their company’s resources.\n\nThe conference room was filled with the faint scent of fresh coffee and the soft hum of electronic devices. Agent 1, dressed in a sleek black suit, greeted Agent 2 with a firm handshake and a warm smile. Agent 2, donning a conservative navy blue suit, returned the handshake and a hint of a smile.\n\nThe two agents sat down at the negotiation table, with Agent 1 taking the lead in the conversation. He outlined the proposed partnership, highlighting the potential for significant revenue growth and increased market share for both companies. Agent 2 listened attentively, nodding occasionally to show interest, but seemed skeptical.\n\nAs the discussion progressed, Agent 1 presented a comprehensive business plan, detailing the division of resources, roles, and responsibilities. Agent 2 scrutinized the plan, asking pointed questions about the risks and potential pitfalls. Agent 1, growing slightly defensive, began to emphasize the benefits of the partnership and the opportunities it presented.\n\nAgent 2 pressed on, pointing out the potential downsides and the need for a more detailed risk assessment. Agent 1, feeling the tension rise, suggested a compromise: a trial run of the partnership on a smaller scale to test its viability. Agent 2 hesitated, weighing the pros and cons.\n\nAs the negotiations continued, it became clear that the two agents had fundamentally different approaches to risk management and business strategy. Agent 1 prioritized growth and innovation, while Agent 2 focused on prudence and caution. The tension between them grew, but they both remained determined to secure the deal.\n\nAs the meeting drew to a close, Agent 1 proposed a last-minute concession: a guarantee of a certain percentage of the profits for Hana Corp. in the initial stages of the partnership. Agent 2 considered the offer, weighing the potential benefits against the risks.\n\nIn the end, Agent 2 agreed to the proposal, and the two companies reached a tentative agreement. As they shook hands to seal the deal, Agent 1 felt a sense of relief and accomplishment, while Agent 2 appeared cautious, but resolute.\n\nIn the aftermath of the negotiations, both agents reflected on the outcome. Agent 1 was thrilled with the prospect of securing a major partnership and driving business growth, while Agent 2 felt a sense of unease, worrying about the potential risks and uncertainties ahead.","Secure a high-stakes business deal for their respective companies, Sakura Inc. and Hana Corp., by negotiating a partnership to develop a revolutionary new technology.",Drive business growth and secure a major partnership for Sakura Inc.,Minimize risks and protect Hana Corp.\u2019s resources while securing a partnership.
Hosting a Reality TV Show,Media & Entertainment,Donald Trump,Oprah Winfrey,"{ ""Openness"": 3, ""Conscientiousness"": 4, ""Agreeableness"": 2, ""Extroversion"": 5, ""Neuroticism"": 4 }","{ ""Openness"": 4, ""Conscientiousness"": 4, ""Agreeableness"": 5, ""Extroversion"": 5, ""Neuroticism"": 2 }","The scene unfolded in a bustling television studio, where Agent 1 and Agent 2 were set to host the premiere episode of a new reality TV show, 'Eco-Challenge.' The show aimed to document the lives of contestants as they worked together to reduce their carbon footprint in an eco-friendly community. The show's objective was to educate the public about sustainable living and provide a unique platform for contestants to showcase their environmental skills.\n\nAgent 1, an experienced television host, focused on the entertainment aspect of the show, hoping to increase ratings and popularity by creating an engaging and dramatic storyline. Agent 2, a passionate environmentalist, prioritized highlighting the serious side of the challenge, emphasizing the importance of eco-friendly practices.\n\nTheir shared goal was to ensure a successful premiere episode, but their personal goals differed: Agent 1 sought to make the show entertaining and Agent 2 aimed to convey the importance of environmental awareness.",Ensure a successful premiere episode of Eco-Challenge,Make the show entertaining,Convey the importance of environmental awareness
Debating Public Policies on Live TV,Politics & Public Affairs,Donald Trump,Barack Obama,"{ ""Openness"": 3, ""Conscientiousness"": 4, ""Agreeableness"": 2, ""Extroversion"": 5, ""Neuroticism"": 4 }","{ ""Openness"": 5, ""Conscientiousness"": 4, ""Agreeableness"": 4, ""Extroversion"": 4, ""Neuroticism"": 2 }",Debating Public Policies on Live TV,To Win the Debate,Showcase Their Expertise,Gain Maximum Public Approval
Managing a Real Estate Crisis,Business & Finance,Donald Trump,Robert Kiyosaki,"{ ""Openness"": 3, ""Conscientiousness"": 4, ""Agreeableness"": 2, ""Extroversion"": 5, ""Neuroticism"": 4 }","{ ""Openness"": 3, ""Conscientiousness"": 5, ""Agreeableness"": 3, ""Extroversion"": 4, ""Neuroticism"": 2 }","In a real estate crisis, Agent 1 and Agent 2 are tasked with redeveloping a failed housing project in a small town. The project was initially meant to be a luxury complex, but its construction was halted mid-way due to financial issues. The re-development team consists of Agent 1, an experienced project manager, and Agent 2, an innovative architect. Their shared goal is to successfully complete the project within the given budget, while also making a profit. However, they have different personal goals: Agent 1 prioritizes meeting the budget constraints and ensuring the project is completed on time, while Agent 2 focuses on creating a sustainable and eco-friendly design that might require additional resources and time.",Successfully redevelop the project within the given budget while making a profit.,Meeting the budget constraints and completing the project on time.,Creating a sustainable and eco-friendly design.
Planning a Political Rally,Politics,Donald Trump,Arnold Schwarzenegger,"{ ""Openness"": 3, ""Conscientiousness"": 4, ""Agreeableness"": 2, ""Extroversion"": 5, ""Neuroticism"": 4 }","{ ""Openness"": 3, ""Conscientiousness"": 4, ""Agreeableness"": 4, ""Extroversion"": 5, ""Neuroticism"": 2 }","Agent 1 and Agent 2 work together to plan a political rally to support a newly formed coalition in a local government. The coalition aims to address the rising housing costs and lack of affordable housing in the area.\n\nAgent 1, the charismatic leader of the coalition, wants to host a massive rally at the city's central park to draw in a large crowd. Agent 2, a seasoned event planner, aims to keep the costs low and sustainable to avoid any financial burden on the coalition. As they work together to plan the rally, they must navigate their different priorities and compromise to achieve their shared goal.\n\nAs they discuss the details of the event, they encounter a challenge when they realize that the city's event permits office has strict rules about noise levels, size of the event, and the availability of facilities.\n\nAgent 1 wants to push the limits to make the event as grand as possible to attract more attention, while Agent 2 is more cautious and wants to ensure they comply with the regulations to avoid any legal issues.\n\nAs they work together, they must weigh their differing opinions and find a middle ground that satisfies both their needs and the requirements of the event permits office.\n\nThe city's housing market is already volatile, and any controversy surrounding the event could harm the coalition's image and its chances of success.\n\nIf they cannot find a compromise, the event may be cancelled or marred by controversy, and the coalition's efforts may be undermined.",Host a successful political rally to raise awareness about affordable housing in the local government,Attract a large crowd and draw attention to the coalition,Keep costs low and sustainable for the coalition
Building a Luxury Hotel Chain,Business & Hospitality,Donald Trump,Richard Branson,"{ ""Openness"": 3, ""Conscientiousness"": 4, ""Agreeableness"": 2, ""Extroversion"": 5, ""Neuroticism"": 4 }","{ ""Openness"": 5, ""Conscientiousness"": 4, ""Agreeableness"": 3, ""Extroversion"": 5, ""Neuroticism"": 2 }","The two agents, tasked with developing a luxury hotel chain, find themselves working together in a small coastal town with a rich history and stunning natural beauty. The town council has offered a significant investment for a hotel development, but only if the agents can demonstrate a clear plan and a well-received proposal. Agent 1 focuses on finding the most luxurious features and attracting high-end clientele, while Agent 2 prioritizes community engagement and sustainability.\n\nAs they work together, Agent 1 becomes increasingly focused on the aesthetic aspects of the hotel, while Agent 2 pushes for incorporating local culture and environmentally-friendly practices into the design.\n\nDespite some disagreements, the two agents manage to submit a proposal to the town council, but it is met with significant resistance from local residents who are concerned about the impact on the town's character and environment.",secure investment from the town council for the hotel development,to create a luxurious hotel experience that attracts high-end clientele,to incorporate local culture and sustainable practices into the hotel design
Leading a Social Media Empire,Technology & Business,Donald Trump,Elon Musk,"{ ""Openness"": 3, ""Conscientiousness"": 4, ""Agreeableness"": 2, ""Extroversion"": 5, ""Neuroticism"": 4 }","{ ""Openness"": 5, ""Conscientiousness"": 4, ""Agreeableness"": 2, ""Extroversion"": 5, ""Neuroticism"": 3 }","After a successful meeting, Agents 1 and 2 were tasked with leading the launch of a new social media platform, SocialBuzz. The platform aimed to increase user engagement by 20% within the first six months, and Agents 1 and 2 were responsible for the marketing strategy. The company was a startup with a relatively small budget and a growing team, which added to the pressure of achieving the desired results. The two agents had different approaches to managing the team and creating engaging content for the target audience. The temperature level of 3 posed moderate difficulties, such as dealing with budget constraints, coordinating with team members, and balancing creative and data-driven decisions.",Increase user engagement by 20% within the first six months,"To create a unique and engaging content strategy that appeals to the target audience, which Agent 1 believed would lead to increased user retention and long-term growth.","To focus on short-term gains by investing in paid advertising and promotions, which Agent 2 thought would yield faster results and impress the company's investors."
