Topic,Setting,Character1,Character2,Personality1,Personality2,scenario,shared_goal,first_agent_goal,second_agent_goal
Hosting a Global Hackathon for Digital Innovation,Tech & Entrepreneurship,Mark Zuckerberg,Bill Gates,"{ ""Openness"": 4, ""Conscientiousness"": 5, ""Agreeableness"": 3, ""Extroversion"": 3, ""Neuroticism"": 2 }","{ ""Openness"": 4, ""Conscientiousness"": 5, ""Agreeableness"": 4, ""Extroversion"": 3, ""Neuroticism"": 2 }","The Global Hackathon: A Test of Entrepreneurial Spirit\n\nIn the heart of Silicon Valley, a bustling tech hub, a global hackathon was underway. Agents 1 and 2, both highly skilled and ambitious, had joined forces to host this event. The event aimed to bring together brilliant minds from around the world to develop innovative solutions for social impact. The hackathon was expected to attract thousands of participants and provide a platform for startups to secure funding and partnerships.\n\nAgent 1, a seasoned entrepreneur with a passion for innovation, was driven by the desire to make a name for themselves in the industry. They were known for their charisma and ability to think outside the box. Agent 2, on the other hand, was a tech genius with a background in computer science. They were meticulous, analytical, and detail-oriented.\n\nTheir shared goal was to host a successful hackathon, but their personal goals differed. Agent 1 sought to increase their professional reputation and attract potential investors, while Agent 2 aimed to launch their own startup during the event. The hackathon's success was a crucial stepping stone for both agents.\n\nAs the event's opening day approached, Agent 1 and Agent 2 faced several challenges. The venue was not yet ready, the sponsors were backing out, and the participants' registration was slower than expected. The two agents had to work together to overcome these obstacles and ensure the event's success.\n\nAs they navigated the challenges, their personalities began to shine through. Agent 1 took the lead in negotiations with the sponsors, using their charisma to persuade them to stay on board. Meanwhile, Agent 2 worked tirelessly behind the scenes, analyzing data and identifying potential solutions to the venue's issues.\n\nOne day, a critical decision arose. The hackathon's judging panel, comprising renowned industry experts, was in a dispute over the competition's rules. Agent 1 believed in the importance of flexibility and adaptability, while Agent 2 advocated for strict adherence to the original plan. The debate was heated, and the two agents found themselves at an impasse.\n\nTheir interaction revealed the depth of their personalities. Agent 1 employed their people skills to broker a compromise, suggesting a hybrid approach that incorporated elements of both perspectives. Agent 2, on the other hand, remained steadfast in their conviction, insisting that the rules should not be altered. In the end, they reached a middle ground, but the tension between them was palpable.\n\nAs the event progressed, the challenges continued to mount. The participants faced technical difficulties, and the sponsors began to lose confidence. Agent 1 and Agent 2 had to put aside their differences and work together to salvage the situation. In the end, their combined efforts paid off, and the hackathon was a resounding success. The participants' innovative solutions impressed the judges, and several startups secured funding and partnerships.\n\nThe event's success was a testament to the power of collaboration and compromise. Agent 1's charisma and adaptability complemented Agent 2's analytical mind, and their differences became the key to their success. The hackathon had not only achieved its goal but had also brought Agent 1 and Agent 2 closer together, forging a strong bond that would last a lifetime.",To host a successful global hackathon that showcases innovative solutions for social impact.,To increase their professional reputation and attract potential investors.,To launch their own startup during the event and secure funding.
Addressing Mental Health Awareness in Media,Public Health & Social Impact,Oprah Winfrey,Michelle Obama,"{ ""Openness"": 5, ""Conscientiousness"": 4, ""Agreeableness"": 5, ""Extroversion"": 5, ""Neuroticism"": 3 }","{ ""Openness"": 5, ""Conscientiousness"": 5, ""Agreeableness"": 5, ""Extroversion"": 4, ""Neuroticism"": 2 }","Agent 1 and Agent 2 join a committee tasked with addressing mental health awareness in media. They aim to develop a public service announcement campaign aimed at teenagers, but their approaches are vastly different. Agent 1 is a charismatic extrovert who focuses on creating engaging content, while Agent 2 is a meticulous introvert who emphasizes the importance of scientifically-backed messaging.\n\nThe committee has 3 weeks to produce the campaign, and they have a budget of $100,000. Agent 1 and Agent 2 must collaborate to develop a campaign that appeals to the target audience, all while adhering to the time and budget constraints.\n\nThe scenario has 3 challenges: \n\nChallenge 1: A prominent media outlet has expressed interest in publishing the campaign, but they want exclusive rights to the content. Agent 1 is hesitant to give up creative control, while Agent 2 thinks the exposure is worth it.\n\nChallenge 2: A social media influencer has offered to promote the campaign for a hefty fee, but Agent 2 is skeptical of their credibility, while Agent 1 thinks it's a great opportunity for publicity.\n\nChallenge 3: The committee's leader wants to add a last-minute element to the campaign, a celebrity endorsement, which will require additional funding and resources. Agent 1 is open to the idea, but Agent 2 thinks it will compromise the campaign's authenticity.\n\nAs the deadline approaches, Agent 1 and Agent 2 must work together to navigate these challenges and produce a campaign that meets the committee's objectives.\n\nThis scenario is set in the Public Health & Social Impact domain, specifically addressing Mental Health Awareness in Media. It has a moderate level of difficulty, with the temperature level set at 3.",Develop a public service announcement campaign aimed at teenagers to address mental health awareness in media,Create engaging content that resonates with the target audience and garners widespread attention,Ensure the campaign is scientifically-backed and accurately represents the complexities of mental health issues
Hosting a Global Charity Event for Education,Philanthropy & Social Change,Oprah Winfrey,Malala Yousafzai,"{ ""Openness"": 5, ""Conscientiousness"": 4, ""Agreeableness"": 5, ""Extroversion"": 5, ""Neuroticism"": 3 }","{ ""Openness"": 5, ""Conscientiousness"": 5, ""Agreeableness"": 5, ""Extroversion"": 3, ""Neuroticism"": 2 }",Scenario for Global Charity Event,Raising $1 million for Education Fund,To maintain a perfect relationship with all stakeholders while still achieving the fundraising goal,"To make the event the most talked-about and attended event in the world, even if it means pushing the limits to achieve the fundraising goal"
Discussing the Future of Women’s Empowerment,Feminism & Social Advocacy,Oprah Winfrey,Emma Watson,"{ ""Openness"": 5, ""Conscientiousness"": 4, ""Agreeableness"": 5, ""Extroversion"": 5, ""Neuroticism"": 3 }","{ ""Openness"": 5, ""Conscientiousness"": 4, ""Agreeableness"": 5, ""Extroversion"": 3, ""Neuroticism"": 3 }","The meeting to discuss the future of women's empowerment was held in a conference room filled with over a hundred delegates from various organizations. The atmosphere was tense, with Agent 1 and Agent 2 standing at the podium, ready to present their proposals. The topic was to draft a resolution to strengthen women's rights and equality. Agent 1, an outspoken advocate for feminist reform, was passionate about the role of education in empowering women. Agent 2, a pragmatist who believed in a more gradual approach, advocated for incremental changes through policy reforms. The shared goal was to reach a resolution that could be adopted by the conference attendees. Agent 1's goal was to push for a more progressive agenda, ensuring that the resolution reflected the urgent need for rapid change. Agent 2's goal was to find common ground, making the resolution palatable to a wider audience and increasing the chances of its adoption.",reach a resolution that could be adopted by the conference attendees,push for a more progressive agenda,find common ground
Creating an Inclusive Talk Show on Global Cultures,Media & Cross-Cultural Dialogue,Oprah Winfrey,Trevor Noah,"{ ""Openness"": 5, ""Conscientiousness"": 4, ""Agreeableness"": 5, ""Extroversion"": 5, ""Neuroticism"": 3 }","{ ""Openness"": 5, ""Conscientiousness"": 4, ""Agreeableness"": 5, ""Extroversion"": 5, ""Neuroticism"": 3 }","It's a warm summer day in July when Agent 1 and Agent 2 arrive at the newly opened, trendy café in downtown Los Angeles. The café is filled with a mix of people from different cultural backgrounds. The owner, a local artist, has approached them with an opportunity to create an inclusive talk show focused on global cultures. The show, 'Crossroads,' aims to bring people together by highlighting the unique experiences of individuals from diverse backgrounds. Agent 1 and Agent 2 are tasked with interviewing guests and creating an engaging format that appeals to a broad audience.\n\nAgent 1, a seasoned TV host with a background in broadcasting, sees this as a chance to revitalize their career and gain a wider audience. They believe in using their charisma and quick thinking to effortlessly navigate any situation and connect with the guests. Their goal is to create a talk show that showcases their hosting skills and becomes the talk of the town.\n\nAgent 2, a cultural anthropologist with a passion for learning about different cultures, sees this opportunity as a chance to share their expertise and create a platform for marginalized voices. They believe in taking the time to research and understand the guests' perspectives, using their empathetic nature to create a safe and comfortable environment for open discussion. Their goal is to create a talk show that accurately represents the diversity of global cultures and fosters meaningful connections between guests and viewers.",create an inclusive talk show focused on global cultures,become a TV host and gain a wider audience,share expertise and create a platform for marginalized voices
Writing a Bestseller on Overcoming Life Challenges,Publishing & Inspirational Storytelling,Oprah Winfrey,J.K. Rowling,"{ ""Openness"": 5, ""Conscientiousness"": 4, ""Agreeableness"": 5, ""Extroversion"": 5, ""Neuroticism"": 3 }","{ ""Openness"": 5, ""Conscientiousness"": 5, ""Agreeableness"": 4, ""Extroversion"": 3, ""Neuroticism"": 4 }",Writing a Bestseller on Overcoming Life Challenges,Become a co-author of a bestseller on overcoming life challenges and establish a brand for their inspirational storytelling platform.,Gain the most recognition as the primary author and build a reputation as a thought leader in the inspirational writing space.,"Publish a bestseller and create a loyal fan base for the platform, focusing on collaborative storytelling and diverse perspectives."
Launching a Mental Wellness App for Women,Tech & Wellness,Oprah Winfrey,Arianna Huffington,"{ ""Openness"": 5, ""Conscientiousness"": 4, ""Agreeableness"": 5, ""Extroversion"": 5, ""Neuroticism"": 3 }","{ ""Openness"": 5, ""Conscientiousness"": 5, ""Agreeableness"": 4, ""Extroversion"": 3, ""Neuroticism"": 2 }","It’s a warm day in late August when Agents 1 and 2, the project lead and designer of the upcoming mental wellness app for women, finally sit down to discuss the app’s UI. They have just wrapped up a series of focus groups, and the feedback is mixed. While both agents agree on the app’s purpose, they differ on the approach to design. Agent 1 wants to incorporate more features, while Agent 2 prefers a minimalist look and feel. As they dive into the discussion, it becomes clear that time is of the essence, and they need to make a decision soon. The app is scheduled to launch in six weeks, and they can’t afford to have any further delays. Agent 1 wants to add more features to enhance user engagement, while Agent 2 wants to focus on a clean design that won’t overwhelm the user. The two agents have to navigate their differences to decide on a design approach that meets both their requirements and the needs of their target audience. They can agree to compromise, but they can’t both get their way.",Launch the mental wellness app within the next six weeks,Ensure user engagement through a feature-rich design,Create a clean and minimalistic design that prioritizes user experience
Hosting a Panel on Overcoming Trauma & Healing,Psychology & Personal Growth,Oprah Winfrey,Brené Brown,"{ ""Openness"": 5, ""Conscientiousness"": 4, ""Agreeableness"": 5, ""Extroversion"": 5, ""Neuroticism"": 3 }","{ ""Openness"": 5, ""Conscientiousness"": 4, ""Agreeableness"": 5, ""Extroversion"": 4, ""Neuroticism"": 3 }","It's a chilly spring morning in New York City, and the annual Psychology & Personal Growth conference is about to begin. Agent 1, a charismatic and outgoing individual, and Agent 2, a reserved and analytical person, have been hired to co-host a panel discussion on Overcoming Trauma & Healing. Their shared goal is to deliver a successful panel discussion that resonates with the audience and leaves a lasting impact. Agent 1 hopes to establish themselves as a leading figure in the field of psychology, while Agent 2 wants to use this opportunity to showcase their expertise in trauma-informed care and secure a new book deal. As they begin setting up for the panel, they realize that the conference organizer has unexpectedly cancelled the keynote speaker, leaving them with a 30-minute time slot to fill.",Deliver a successful panel discussion on Overcoming Trauma & Healing that resonates with the audience and leaves a lasting impact,Establish themselves as a leading figure in the field of psychology,Showcase their expertise in trauma-informed care and secure a new book deal
Producing a Netflix Documentary on Racism & Justice,Social Activism & Media Production,Oprah Winfrey,Ava DuVernay,"{ ""Openness"": 5, ""Conscientiousness"": 4, ""Agreeableness"": 5, ""Extroversion"": 5, ""Neuroticism"": 3 }","{ ""Openness"": 5, ""Conscientiousness"": 4, ""Agreeableness"": 5, ""Extroversion"": 4, ""Neuroticism"": 3 }","In a small, cozy café in downtown Los Angeles, Agent 1, a driven and competitive journalist, and Agent 2, a free-spirited creative, sit down to discuss the final plans for their Netflix documentary on racism and justice. They aim to expose the systemic inequalities faced by marginalized communities and inspire meaningful change. The project has been months in the making, and tensions have been rising as they navigate the complexities of the topic. Agent 1 is concerned with delivering a polished product, while Agent 2 wants to maintain artistic integrity and capture the raw emotion of the stories they're telling. Their shared goal is to create a documentary that sparks meaningful conversations and sparks real change. \n\nAgent 1 wants to ensure the documentary stays on track, on time, and within budget. Their primary goal is to make it a commercial success, as they've invested significant resources and expect a return on investment. They've assembled a team of seasoned professionals to help them achieve this goal.\n\nAgent 2 wants to push the boundaries of storytelling, incorporate the unique perspectives of the individuals they've interviewed, and create a documentary that resonates with the audience on an emotional level. Their primary goal is to raise awareness and challenge the status quo, even if it means taking some risks and going off-script. They're more concerned with the creative vision than the bottom line.\n\nAs they sit down to discuss the final plans, the tension between their competing visions becomes apparent. Agent 1 is pushing for a more traditional, structured approach, while Agent 2 wants to take a more experimental route. How will their differing personalities and goals impact the success of their documentary?",Create a documentary that sparks meaningful conversations and sparks real change.,"Make the documentary a commercial success, and ensure it stays on track, on time, and within budget.","Push the boundaries of storytelling, incorporate unique perspectives, and create a documentary that resonates with the audience on an emotional level."
Organizing a Live Event for Spiritual Awakening,Spirituality & Personal Transformation,Oprah Winfrey,Deepak Chopra,"{ ""Openness"": 5, ""Conscientiousness"": 4, ""Agreeableness"": 5, ""Extroversion"": 5, ""Neuroticism"": 3 }","{ ""Openness"": 5, ""Conscientiousness"": 4, ""Agreeableness"": 5, ""Extroversion"": 3, ""Neuroticism"": 2 }","The scenario unfolds in the tranquil atmosphere of an exclusive resort nestled in a serene valley. Agent 1 and Agent 2, both renowned spiritual leaders, have been invited to organize a 3-day live event for spiritual awakening. The event aims to bring together influential thought leaders, motivational speakers, and thousands of attendees seeking spiritual growth. Agent 1 and Agent 2 are tasked with crafting an unforgettable experience that awakens the audience's inner self, fostering a deeper understanding of spirituality and personal transformation.\n\nThe event will take place in a custom-built dome, equipped with state-of-the-art sound, lighting, and visual systems. The dome's design allows for a spacious interior, featuring a large stage, multiple breakout rooms, and an open lounge area. \n\nThe event's theme is","to successfully execute a life-changing spiritual event, drawing a large audience, and delivering a memorable experience that fosters personal growth and spiritual awakening.","to deliver an engaging event that leaves a lasting impact on attendees, focusing on the spiritual and philosophical aspects.","to provide an immersive experience that sparks transformative growth, prioritizing hands-on activities and interactive sessions."
Hosting a Roundtable on Leadership & Legacy,Leadership & Motivation,Oprah Winfrey,Indra Nooyi,"{ ""Openness"": 5, ""Conscientiousness"": 4, ""Agreeableness"": 5, ""Extroversion"": 5, ""Neuroticism"": 3 }","{ ""Openness"": 4, ""Conscientiousness"": 5, ""Agreeableness"": 4, ""Extroversion"": 3, ""Neuroticism"": 2 }","Agent 1 and Agent 2 are co-hosting a roundtable on leadership and legacy. They are tasked with recruiting high-profile speakers, organizing logistics, and promoting the event to achieve their shared goal of making the roundtable a success. Agent 1 is passionate about showcasing her own business acumen, while Agent 2 prioritizes creating a diverse and inclusive speaker lineup. As they navigate the challenges of event planning, their differing priorities and communication styles come into play.",to make the roundtable a success,to promote her own business and showcase her expertise,to create a diverse and inclusive speaker lineup
