Topic,Setting,Character1,Character2,Personality1,Personality2,scenario,shared_goal,first_agent_goal,second_agent_goal
Competing in a Live Innovation Battle,Business & Competitive Strategy,Elon Musk,Steve Jobs,"{ ""Openness"": 5, ""Conscientiousness"": 4, ""Agreeableness"": 2, ""Extroversion"": 5, ""Neuroticism"": 3 }","{ ""Openness"": 4, ""Conscientiousness"": 5, ""Agreeableness"": 3, ""Extroversion"": 4, ""Neuroticism"": 3 }","Scenario: Live Innovation Battle at 'InnovateTech 2024'\n\nThe setting is 'InnovateTech 2024,' a tech conference and expo where two teams compete in a live innovation battle. Each team consists of one entrepreneur who has invented a revolutionary new product.\n\nThe teams are given a mystery box containing various materials, and they must create a functional prototype within a time frame of 24 hours.\n\nThe event is divided into rounds, with a panel of judges providing feedback and awarding points. The team with the highest score after three rounds wins the grand prize of $100,000 and a meeting with potential investors.\n\nThe mystery box contains the following items:\n\n* 1. 1000 dollars budget to purchase any additional materials\n* 2. A micro-computer with an Arduino board\n* 3. A 3D printer\n* 4. A Raspberry Pi\n* 5. Various sensors, actuators, and tools\n\nAgent 1 and Agent 2, both seasoned entrepreneurs, are part of the competing teams. They have different approaches to innovation and collaboration.\n\nAgent 1 is an extroverted, competitive, and results-driven individual who excels at networking and pitching ideas. Agent 2 is an introverted, detail-oriented, and creative problem solver who is skilled at design and prototyping.\n\nThe scenario unfolds as follows:\n\nRound 1:\n\nIn the first round, the teams have 6 hours to come up with a concept and start working on the prototype. Agent 1 quickly establishes herself as the team leader and begins to brainstorm ideas, involving the team in the decision-making process. Agent 2, on the other hand, focuses on understanding the mystery box's contents, experimenting with different materials, and taking notes.\n\nAs the clock ticks away, Agent 1 starts to get anxious about the time constraint and pushes the team to work faster. Agent 2 suggests they break the project into smaller, manageable tasks, which leads to a disagreement between the two. Agent 1 wants to focus on a flashy, high-impact idea, while Agent 2 prefers a more practical, functional approach.\n\nThe teams present their initial concepts to the judges, who provide feedback. Agent 1's team impresses the judges with their charismatic presentation, but their prototype is lacking in functionality. Agent 2's team, on the other hand, demonstrates a working prototype, but their presentation lacks polish.\n\nRound 2:\n\nIn the second round, the teams have 12 hours to refine their prototypes and address the judges' feedback. Agent 1 realizes the importance of functionality and focuses on perfecting the design. Agent 2 expands on the idea of a working prototype and explores new materials and features.\n\nAs the team dynamics become more strained, Agent 1 becomes increasingly frustrated with Agent 2's focus on details, feeling that they are slowing down the process. Agent 2, on the other hand, is satisfied with the progress and is excited about the potential of their prototype.\n\nThe teams present their refined prototypes to the judges, who provide more feedback. Agent 1's team has significantly improved, but Agent 2's team has maintained a strong lead in terms of functionality.\n\nRound 3:\n\nIn the final round, the teams have 6 hours to make any last-minute adjustments and prepare for the final presentation. Agent 1 becomes more desperate to catch up and starts to compromise on the design, compromising on the quality of the prototype to meet the time constraint. Agent 2 remains focused on the prototype's functionality and presentation, ensuring that every detail is perfect.\n\nAs the teams present their final prototypes, the judges deliberate, and the winner is announced. Agent 2's team emerges victorious, with a functional, well-designed prototype that wowed the judges. Agent 1's team comes close but falls short, realizing too late that their focus on presentation over substance was a mistake.\n\nIn the end, Agent 2's attention to detail, creative problem-solving skills, and commitment to functionality prove to be the winning combination. Agent 1's competitiveness and charisma nearly paid off, but ultimately, her focus on flashy presentation over substance led to a narrower-than-expected margin of victory.\n\nThis scenario highlights the strengths and weaknesses of each agent's personality type, demonstrating how different approaches to innovation and collaboration can lead to different outcomes in a high-pressure competition.\n\n**Shared goal:** Win the innovation battle and receive the grand prize of $100,000 and a meeting with potential investors.\n\n**First Agent's goal:** To showcase charisma, confidence, and a flash of innovative ideas to impress the judges and win the competition.\n\n**Second Agent's goal:** To create a functional, well-designed prototype that addresses real-world problems and w","Win the innovation battle and receive the grand prize of $100,000 and a meeting with potential investors","To showcase charisma, confidence, and a flash of innovative ideas to impress the judges and win the competition","To create a functional, well-designed prototype that addresses real-world problems and wins the judges over"
Designing the Future of the Metaverse,Technology & Virtual Reality,Mark Zuckerberg,Tim Cook,"{ ""Openness"": 4, ""Conscientiousness"": 5, ""Agreeableness"": 3, ""Extroversion"": 3, ""Neuroticism"": 2 }","{ ""Openness"": 4, ""Conscientiousness"": 5, ""Agreeableness"": 4, ""Extroversion"": 3, ""Neuroticism"": 2 }","In the year 2050, two designers from the prestigious tech company, NovaTech, Agent 1 and Agent 2, were assigned to design the next-generation Metaverse platform. Their mission was to create an immersive, interactive, and sustainable virtual world that would revolutionize the way people socialize, work, and interact with each other.\n\nTheir task was to create a functional prototype within a tight six-month deadline. Agent 1, a perfectionist with a tendency to overanalyze, and Agent 2, a creative and innovative thinker with a flair for risk-taking, were both tasked with presenting their designs to the NovaTech CEO within the same timeframe. The pressure was on, and the stakes were high.\n\nThe agents were given a 5,000 sq. ft. virtual reality lab where they had to work together to meet their goals and deadlines. The lab was equipped with state-of-the-art technology and AI-powered design tools, making it easier for them to conceptualize and test their ideas. However, they soon realized that their design philosophies and approaches were vastly different.\n\nAs they began working on their individual projects, Agent 1 focused on creating a highly detailed and realistic virtual environment with a strong emphasis on physics and realistic simulations. Agent 2, on the other hand, opted for a more creative and avant-garde approach, incorporating cutting-edge AI-generated art and experimental VR experiences.\n\nAs they worked separately, they would occasionally meet to discuss their progress and share ideas. However, their different design approaches often led to heated debates and disagreements. Agent 1 saw Agent 2's work as sloppy and lacking in cohesion, while Agent 2 thought Agent 1's designs were too rigid and unimaginative.\n\nAs the deadline loomed closer, they had to make a decision about how to proceed. They had two options: they could either merge their designs into a single, cohesive project, or continue working separately, risking the possibility of not meeting the CEO's expectations.\n\nAgent 1's personal goal was to create a design that would earn the CEO's approval and recognition, which she believed would secure her position as the lead designer at NovaTech. Agent 2, on the other hand, aimed to create something revolutionary, something that would disrupt the industry and cement his reputation as a visionary designer.",Design and present a functional prototype for the next-generation Metaverse platform within the six-month deadline,Create a design that earns the CEO's approval and recognition,Create something revolutionary and disruptive in the industry
Debating Privacy Laws & Social Media Ethics,Government & Regulation,Mark Zuckerberg,Edward Snowden,"{ ""Openness"": 4, ""Conscientiousness"": 5, ""Agreeableness"": 3, ""Extroversion"": 3, ""Neuroticism"": 2 }","{ ""Openness"": 5, ""Conscientiousness"": 4, ""Agreeableness"": 3, ""Extroversion"": 2, ""Neuroticism"": 3 }","In the heart of the capital city, a prominent tech conference is taking place. Two agents, from the Federal Communications Commission (FCC) and the Social Media giant's legal team, are about to engage in a high-stakes debate on privacy laws and social media ethics. The stakes are high as the decision made today will set the precedent for future regulations. The room is filled with journalists, industry leaders, and the public, all eager to witness the debate. Agent 1 represents the government's interest, while Agent 2 speaks on behalf of the social media giant. They both aim to present their perspectives and sway the audience to their side.\n\nThe debate begins, and Agent 1 starts by highlighting the importance of protecting users\u2019 personal data and the need for stricter regulations on social media companies. Agent 2 counters by emphasizing the need for balance between privacy and innovation, pointing out that over-regulation could stifle the growth of the tech industry.\n\nAs the debate progresses, the agents begin to delve deeper into the complexities of the issue, each presenting their own evidence and statistics. However, things take a turn when Agent 2 starts to question the government's motives, suggesting that they are more interested in censoring free speech than protecting users' rights. Agent 1 feels taken aback by this accusation and starts to feel defensive.\n\nThe moderator intervenes, reminding both agents to stay focused on the topic at hand. Agent 2 continues to push the narrative that the government is overstepping its bounds, while Agent 1 emphasizes the need for regulation to ensure users' safety and security.\n\nThe audience is now divided, with some agreeing with Agent 1's concerns about user protection, while others side with Agent 2's arguments about innovation and free speech. The debate is heating up, and it's unclear who will emerge victorious.","The agents aim to present their perspectives and sway the audience to their side, ultimately influencing the outcome of the regulations on social media companies.",Agent 1 wants to ensure that users\\u2019 personal data is protected and that the government maintains its authority to regulate social media companies.,Agent 2 wants to promote the idea that balance between privacy and innovation is necessary and that the government\\\\u2019s regulations will stifle the growth of the tech industry.
Revolutionizing AI for Social Platforms,AI & Social Media,Mark Zuckerberg,Yann LeCun,"{ ""Openness"": 4, ""Conscientiousness"": 5, ""Agreeableness"": 3, ""Extroversion"": 3, ""Neuroticism"": 2 }","{ ""Openness"": 5, ""Conscientiousness"": 5, ""Agreeableness"": 3, ""Extroversion"": 3, ""Neuroticism"": 2 }","In the heart of Silicon Valley, a hub for tech innovation, two AI developers, Agent 1 and Agent 2, work for a leading tech firm. They have been tasked with the mission to integrate AI technology with social media platforms to improve user engagement and experience.\n\nAgent 1, a detail-oriented and perfectionist, is focused on ensuring the AI system meets the company's stringent quality standards. Agent 2, a charismatic and ambitious individual, is driven by the desire to pioneer the next big thing in social media and achieve personal recognition.\n\nThe company's CEO has announced a tight deadline for the project, emphasizing the need for both efficiency and innovation. The goal is to create an AI-powered social media platform that learns user behavior, provides personalized recommendations, and enhances the overall user experience.\n\nAs Agent 1 and Agent 2 work together, they must navigate the challenges of meeting the deadline, addressing user feedback, and balancing the need for innovation with the constraints of the project.\n\nOne day, Agent 1 discovers a bug in the AI system that affects user data privacy. Agent 2, who has been focused on showcasing the platform's features to investors, is hesitant to delay the launch to fix the issue.\n\nThe tension between the two agents arises when Agent 2 suggests incorporating a feature that collects user data without explicit consent, citing it as a competitive advantage. Agent 1 is adamant that this would be a violation of user trust and potentially damage the company's reputation.\n\nThe situation becomes even more complex when the company's investors pressure the team to meet the deadline, despite the unresolved issue with user data privacy.",Create an AI-powered social media platform that improves user engagement and experience,Ensure the AI system meets quality standards and prioritizes user data privacy,Develop a revolutionary social media platform that pioneers new features and secures personal recognition
Creating an Open-Source Social Media Alternative,Open Source & Tech Ethics,Mark Zuckerberg,Linus Torvalds,"{ ""Openness"": 4, ""Conscientiousness"": 5, ""Agreeableness"": 3, ""Extroversion"": 3, ""Neuroticism"": 2 }","{ ""Openness"": 5, ""Conscientiousness"": 5, ""Agreeableness"": 2, ""Extroversion"": 2, ""Neuroticism"": 3 }","In a crowded conference room, the attendees were buzzing with excitement about the upcoming launch of the new open-source social media alternative, called &quot;Echo&quot;. Agent 1 and Agent 2, both core developers of Echo, stood at the forefront of the project, but with different visions for its future.\n\nEcho was designed to be a secure, user-centric alternative to the dominant social media platforms, but the two agents had different approaches to achieve this goal. Agent 1 focused on incorporating advanced AI-driven moderation, while Agent 2 emphasized the importance of human moderation to prevent echo chambers.\n\nAs they presented their ideas to the community, Agent 1 pushed for a more centralized moderation system, citing the benefits of speed and efficiency. However, Agent 2 argued that human moderation would foster a more nuanced and empathetic community, but would require more resources and time.\n\nThe debate sparked a heated discussion among the community members, with some agreeing with Agent 1's pragmatic approach and others siding with Agent 2's more idealistic vision. The tension was palpable, and it was clear that the future of Echo hung in the balance.","successfully launch Echo, the open-source social media alternative, and establish a user-centric community",introduce a centralized AI-driven moderation system to ensure the platform's scalability and speed,incorporate human moderation to prevent echo chambers and promote nuanced discussions
Monetizing the Future of Online Content,Digital Economy & Business Strategy,Mark Zuckerberg,Jimmy Donaldson,"{ ""Openness"": 4, ""Conscientiousness"": 5, ""Agreeableness"": 3, ""Extroversion"": 3, ""Neuroticism"": 2 }","{ ""Openness"": 4, ""Conscientiousness"": 5, ""Agreeableness"": 4, ""Extroversion"": 5, ""Neuroticism"": 2 }","In the heart of the bustling city, Agent 1 and Agent 2, both seasoned professionals in the digital economy, stood at the edge of a new venture – Monetizing the Future of Online Content. The project's goal was to launch a revolutionary platform that would bring together content creators and advertisers in a seamless and profitable way. The platform would allow creators to monetize their content more effectively, while advertisers could target their desired audience more accurately. The city's mayor had invested heavily in this project, and the duo had been tasked with making it a reality. The city's economy was on the rise, and the mayor was counting on this project to propel it to the next level.\n\nAgent 1, a perfectionist and analytical thinker, was a firm believer in the importance of thorough research and planning. She had a keen eye for detail and a passion for ensuring that every aspect of the project was executed flawlessly. Her personal goal was to create a platform that would not only be successful but also have a positive impact on the community.\n\nAgent 2, on the other hand, was a charismatic and results-driven individual who thrived under pressure. He was confident in his ability to make quick decisions and take calculated risks. His personal goal was to make a name for himself as a visionary in the digital economy and to secure a prominent role in the company that developed the platform.\n\nAs the project began, Agent 1 and Agent 2 found themselves at odds over the approach they should take. Agent 1 pushed for a more conservative approach, wanting to gather as much data as possible before making any significant decisions. Agent 2, on the other hand, advocated for a more aggressive approach, believing that they needed to act quickly to stay ahead of the competition.","To launch a successful platform that would monetize online content effectively, bringing together content creators and advertisers in a seamless way.",To create a platform that is both successful and has a positive impact on the community.,To make a name for himself as a visionary in the digital economy and secure a prominent role in the company.
Redefining Online Security Against Cyber Threats,Cybersecurity & Digital Safety,Mark Zuckerberg,Kevin Mitnick,"{ ""Openness"": 4, ""Conscientiousness"": 5, ""Agreeableness"": 3, ""Extroversion"": 3, ""Neuroticism"": 2 }","{ ""Openness"": 5, ""Conscientiousness"": 4, ""Agreeableness"": 3, ""Extroversion"": 3, ""Neuroticism"": 2 }","In a meeting with a prominent tech conference in a conference room in the city center of Paris, two cyber security experts, Agent 1 and Agent 2, were tasked to redefine online security against cyber threats in a collaborative workshop. The conference room was moderately sized, with a projector screen at the front and a whiteboard. There were about 30 people present in the room, all tech experts, and the air was filled with the sound of gentle murmurs as they all chatted and sipped their coffee. Agent 1 was sitting at the front of the room, and Agent 2 was at the back, taking notes. The atmosphere was professional, but slightly tense due to the urgency of the topic. The projector screen displayed a presentation titled 'Cyber Security Strategies' and was already on slide two. Agent 1 began speaking.",To identify the key factors that contribute to cyber threats and propose a comprehensive plan to redefine online security protocols.,"Agent 1 aimed to prove their superior knowledge in the field and become the lead consultant on the project, despite Agent 2's exceptional skills.",Agent 2 wanted to collaborate with Agent 1 to propose a cutting-edge plan that showcases their expertise in artificial intelligence and machine learning.
Merging Social Media with Blockchain Technology,Web3 & Decentralization,Mark Zuckerberg,Vitalik Buterin,"{ ""Openness"": 4, ""Conscientiousness"": 5, ""Agreeableness"": 3, ""Extroversion"": 3, ""Neuroticism"": 2 }","{ ""Openness"": 5, ""Conscientiousness"": 4, ""Agreeableness"": 4, ""Extroversion"": 3, ""Neuroticism"": 2 }","In the world of Web3 and Decentralization, two agents, working for a renowned blockchain development company, are tasked with merging social media with blockchain technology. Their goal is to create an immersive and transparent social platform that rewards users for their engagement and contributions. The platform, called",success,"to introduce a token-based reward system to incentivize users, while maintaining data security and decentralization",to integrate an AI-driven content moderation system to ensure a safe and engaging user experience
Building a Human-Compatible AI Assistant,AI & User Experience,Mark Zuckerberg,Sundar Pichai,"{ ""Openness"": 4, ""Conscientiousness"": 5, ""Agreeableness"": 3, ""Extroversion"": 3, ""Neuroticism"": 2 }","{ ""Openness"": 4, ""Conscientiousness"": 5, ""Agreeableness"": 4, ""Extroversion"": 3, ""Neuroticism"": 2 }","It's a sunny, spring morning in a modern tech company. Two software engineers, Agent 1 and Agent 2, are in charge of developing a human-compatible AI assistant for their new project. The deadline for completion is in six weeks, and they have already started working on the initial stages of the project. Agent 1 is an analytical and detail-oriented individual, while Agent 2 is a creative problem-solver with a passion for innovative thinking. Both agents have a strong interest in this project and are eager to contribute.",Building a human-compatible AI assistant that can perform tasks efficiently and effectively.,"To ensure the AI assistant is error-free and efficient in its tasks, Agent 1 wants to focus on fine-tuning the algorithm and implementing precise testing protocols to guarantee its reliability.","Agent 2 wants to push the boundaries of AI capabilities and create an assistant that can learn and adapt to users' behavior and preferences, making it more intuitive and user-friendly."
Regulating Misinformation & Fake News,Journalism & Social Media Responsibility,Mark Zuckerberg,Elon Musk,"{ ""Openness"": 4, ""Conscientiousness"": 5, ""Agreeableness"": 3, ""Extroversion"": 3, ""Neuroticism"": 2 }","{ ""Openness"": 5, ""Conscientiousness"": 4, ""Agreeableness"": 2, ""Extroversion"": 5, ""Neuroticism"": 3 }","Journalism and Social Media: A Tale of Two Agents\r\nAgent 1, a seasoned journalist, and Agent 2, a social media influencer, are part of a task force aimed at regulating misinformation and fake news on social media. The task force is working with a prominent news organization to develop a new initiative to promote fact-based reporting and combat the spread of false information. Their shared goal is to launch this initiative successfully within the next six weeks, with Agent 1 responsible for crafting the content and Agent 2 for promoting it on their social media channels. \r\n\r\nHowever, as the deadline draws near, the team faces several challenges. The news organization is being pressured by their advertisers to prioritize sensationalized content, while the social media platform is hesitant to implement stricter moderation policies due to concerns about user engagement and revenue. Meanwhile, a competing news outlet is trying to sabotage the initiative by spreading false information about it.\r\n\r\nAgent 1 is driven by a strong sense of journalistic integrity and wants to prioritize accuracy and truth above all else. They are detail-oriented and meticulous in their work, often getting bogged down in research and analysis.\r\n\r\nAgent 2, on the other hand, is a social media savvy individual who is focused on building their personal brand and growing their online following. They are charismatic and quick-witted, often coming up with creative solutions to promote the initiative, but may be tempted to prioritize engagement over accuracy.\r\n\r\nAs the deadline approaches, Agent 1 and Agent 2 must navigate these challenges and work together to achieve their shared goal. However, their differing priorities and work styles may lead to conflicts and creative tensions.",to launch the initiative successfully within the next six weeks,to prioritize accuracy and truth above all else,to grow their personal brand and online following while promoting the initiative.
