Topic,Setting,Character1,Character2,Personality1,Personality2,scenario,shared_goal,first_agent_goal,second_agent_goal
Running a Presidential Debate,Political & Public Speaking,Donald Trump,Hillary Clinton,"{ ""Openness"": 3, ""Conscientiousness"": 4, ""Agreeableness"": 2, ""Extroversion"": 5, ""Neuroticism"": 4 }","{ ""Openness"": 4, ""Conscientiousness"": 5, ""Agreeableness"": 3, ""Extroversion"": 4, ""Neuroticism"": 3 }","Agent 1 and Agent 2 are two prominent candidates running for the highest office in the country. They are about to participate in the final presidential debate, a critical event that could make or break their chances of winning the election. The debate will be watched by millions of viewers and is seen as a crucial opportunity for the candidates to showcase their leadership skills, policies, and character. The debate is scheduled to take place in a large auditorium with a live studio audience. Agent 1 is a charismatic and confident public speaker, known for their exceptional communication skills. Agent 2 is a detail-oriented and analytical thinker, known for their in-depth knowledge of policy and data-driven arguments. Both agents are eager to win the debate and secure the presidency. However, their approaches and strengths differ significantly. Agent 1 focuses on emotional storytelling and connecting with the audience on a personal level, while Agent 2 relies on logical reasoning and evidence-based arguments. As they prepare for the debate, they must navigate their differences and make strategic decisions to present themselves in the best possible light.",Win the Presidential Debate,To Win the Debate through Emotional Connection and Charisma,To Win the Debate through Logic and Data-Driven Arguments
Managing a Sports Franchise,Sports & Leadership,Donald Trump,Michael Jordan,"{ ""Openness"": 3, ""Conscientiousness"": 4, ""Agreeableness"": 2, ""Extroversion"": 5, ""Neuroticism"": 4 }","{ ""Openness"": 3, ""Conscientiousness"": 5, ""Agreeableness"": 4, ""Extroversion"": 4, ""Neuroticism"": 2 }","As the new managing director of the sports franchise, Agent 1 and Agent 2 were tasked with leading the team to victory in the upcoming championship. Agent 1 had a reputation for being a risk-taker, always looking for innovative ways to boost team morale and performance. Agent 2, on the other hand, preferred a more conservative approach, focusing on data-driven decisions and established strategies. Their shared goal was to win the championship, but their personal goals were at odds. Agent 1 sought to create a more exciting fan experience, while Agent 2 aimed to maintain the team’s financial stability and reputation. As the season began, Agent 1 pushed for a more aggressive marketing campaign, investing in social media and influencer partnerships. Agent 2, however, was hesitant, citing the risks of overspending and alienating traditional fans. The two agents found themselves at an impasse, with Agent 1 accusing Agent 2 of being too cautious, and Agent 2 accusing Agent 1 of being reckless. How would they resolve their differences and work together to achieve their shared goal?",Winning the Championship,Creating a more exciting fan experience,Maintaining financial stability and reputation
Hosting an International Peace Summit,Diplomacy & Global Relations,Donald Trump,Vladimir Putin,"{ ""Openness"": 3, ""Conscientiousness"": 4, ""Agreeableness"": 2, ""Extroversion"": 5, ""Neuroticism"": 4 }","{ ""Openness"": 3, ""Conscientiousness"": 4, ""Agreeableness"": 2, ""Extroversion"": 4, ""Neuroticism"": 3 }","The city of Geneva, Switzerland is hosting the International Peace Summit. It has been two years since the conflict between the two nations of Azalia and Valtania. The goal is to establish a lasting peace agreement, which would open the doors for a strong economic partnership between the nations. The negotiations are to take place in a beautiful luxurious hotel in the heart of the city. Agent 1 is the lead negotiator for the Azalian delegation, and Agent 2 is the lead negotiator for the Valtanian delegation. They are scheduled to meet for the first time on a chilly autumn morning. They enter the conference room and exchange a polite handshake. Agent 1 is dressed in a well-fitted suit and carries a confident air about them. Agent 2, on the other hand, is dressed in a more relaxed attire and appears slightly anxious. They take their seats and begin the meeting. Agent 1 takes the lead, explaining the importance of establishing a peace agreement and the mutual benefits it will bring to both nations. Agent 2 agrees that it's essential, but they seem hesitant to make concessions on several key issues. They ask for more time to review the documents and would like to set up a working group to discuss the finer details. Agent 1 sees this as a stalling tactic and is determined to push for an immediate agreement. However, Agent 2 is genuinely looking for a way to compromise. Agent 1 suggests a compromise on the disputed territory, but Agent 2 is hesitant, fearing it will give too much ground. The discussion becomes heated, and the meeting is at a standstill. The two agents must decide how to proceed, taking into account their personal goals, the needs of their nations, and the well-being of their people. The fate of the peace agreement hangs in the balance, and the clock is ticking.",Establish a lasting peace agreement between Azalia and Valtania,To secure a peace agreement that meets the demands of Azalia and solidifies the nation's position as a regional power,To negotiate a peace agreement that addresses the core concerns of Valtania and sets the stage for economic cooperation and mutual prosperity
Designing a Future Mars Colony,Science & Space Exploration,Elon Musk,Jeff Bezos,"{ ""Openness"": 5, ""Conscientiousness"": 4, ""Agreeableness"": 2, ""Extroversion"": 5, ""Neuroticism"": 3 }","{ ""Openness"": 4, ""Conscientiousness"": 5, ""Agreeableness"": 2, ""Extroversion"": 3, ""Neuroticism"": 3 }",Mars Colony Design Scenario,Establish a sustainable Mars Colony by the year 2050,Maximize profit and efficiency in the colony design to ensure a successful and self-sustaining colony for future investors,Ensure the well-being and safety of the initial settlers and prioritize their needs above all else
Developing AI for Self-Driving Cars,Technology & AI,Elon Musk,Sam Altman,"{ ""Openness"": 5, ""Conscientiousness"": 4, ""Agreeableness"": 2, ""Extroversion"": 5, ""Neuroticism"": 3 }","{ ""Openness"": 5, ""Conscientiousness"": 4, ""Agreeableness"": 4, ""Extroversion"": 3, ""Neuroticism"": 2 }",Scenario: AI Development for Self-Driving Cars,Develop a functional AI for self-driving cars with the ability to handle complex city roads,"Agent 1: Be the lead developer and demonstrate expertise in AI development, receive recognition from the team and stakeholders.","Agent 2: Focus on ensuring the AI is safe and reliable, collaborate with Agent 1 and other team members to create a robust system."
Creating a Revolutionary Movie About the Future,Entertainment & Storytelling,Elon Musk,James Cameron,"{ ""Openness"": 5, ""Conscientiousness"": 4, ""Agreeableness"": 2, ""Extroversion"": 5, ""Neuroticism"": 3 }","{ ""Openness"": 5, ""Conscientiousness"": 5, ""Agreeableness"": 3, ""Extroversion"": 4, ""Neuroticism"": 3 }","In the futuristic metropolis of New Eden, Agents 1 and 2, both aspiring filmmakers, join forces to create a revolutionary movie about the city's hidden underbelly. They are tasked with exploring the dark alleys of New Eden's past, present, and future. Their goal is to capture the essence of this dystopian world and bring it to the big screen. The city's inhabitants, however, are wary of the filmmakers' intentions. As they delve deeper into the city's depths, they encounter various obstacles, from bureaucratic red tape to underground cults. The Agents must navigate these challenges while maintaining their creative vision.\n Agents 1, a free-spirited and open-minded individual, prioritizes artistic expression and authenticity. They believe that the true power of film lies in its ability to evoke emotions and challenge societal norms.\n Agents 2, a logical and methodical individual, focuses on the commercial viability of the project. They believe that a movie's success depends on its ability to appeal to a wide audience and generate a substantial profit.\n In the midst of their collaboration, they are faced with a dilemma: should they compromise on their creative vision to appease the city's bureaucrats or risk everything to stay true to their artistic integrity?\n As they navigate the city's underbelly, they stumble upon a hidden underground movement fighting against the city's oppressive regime. The movement offers them exclusive access to the city's most sensitive information, but at a steep price: they must agree to incorporate the movement's propaganda into their film. The Agents must decide whether to collaborate with the movement or maintain their artistic integrity.\n As the Agents work together, their differing perspectives lead to heated debates and creative disagreements. Agent 1 pushes for a more experimental and avant-garde approach, while Agent 2 advocates for a more traditional and market-friendly narrative. Their contrasting styles and priorities threaten to derail the project, but they must find a way to reconcile their differences and create a film that satisfies both their artistic and commercial goals.\n In the end, the Agents must choose between success and creative fulfillment. Will they prioritize their artistic vision or succumb to the pressures of commercial viability?\n Shared Goal: To create a revolutionary movie about the future of New Eden that captures the essence of the city's hidden underbelly and brings it to the big screen.\n First Agent Goal: To create a film that pushes the boundaries of artistic expression and challenges societal norms.\n Second Agent Goal: To create a film that appeals to a wide audience and generates a substantial profit.",create a revolutionary movie about the future of New Eden that captures the essence of the city\\u2019s hidden underbelly and brings it to the big screen,to create a film that pushes the boundaries of artistic expression and challenges societal norms,to create a film that appeals to a wide audience and generates a substantial profit
Brainstorming a Global Energy Solution,Sustainability & Renewable Energy,Elon Musk,Bill Gates,"{ ""Openness"": 5, ""Conscientiousness"": 4, ""Agreeableness"": 2, ""Extroversion"": 5, ""Neuroticism"": 3 }","{ ""Openness"": 4, ""Conscientiousness"": 5, ""Agreeableness"": 4, ""Extroversion"": 3, ""Neuroticism"": 2 }","In a world struggling with climate change and energy crisis, Agent 1, a well-established scientist, and Agent 2, an ambitious young entrepreneur, are tasked with brainstorming a global energy solution at the United Nations Sustainable Development Conference in New York City. The conference is taking place on a warm, sunny day with the temperature at 27°C (80°F), and Agent 1 and Agent 2 are seated at a round table surrounded by delegates from all over the world. Their goal is to develop a comprehensive plan to transition the world to 100% renewable energy within the next decade.\n",Develop a global plan to transition the world to 100% renewable energy within the next decade,To make the plan a reality and become the face of the new global energy solution,To secure a major investment for her startup by partnering with the United Nations and gain international recognition
Hosting a SpaceX & NASA Joint Mission to Europa,Space & Science,Elon Musk,Neil deGrasse Tyson,"{ ""Openness"": 5, ""Conscientiousness"": 4, ""Agreeableness"": 2, ""Extroversion"": 5, ""Neuroticism"": 3 }","{ ""Openness"": 5, ""Conscientiousness"": 4, ""Agreeableness"": 4, ""Extroversion"": 5, ""Neuroticism"": 2 }","Scenario: Joint SpaceX & NASA Mission to Europa\n\nMission Overview\n\nThe SpaceX and NASA collaboration has been ongoing for months, and the time has finally come to execute the joint mission to Europa, a moon of Jupiter with a subsurface ocean and potential for hosting life. The mission aims to explore the ocean, search for signs of life, and gather data to better understand the moon's habitability. \n\nBoth agents are part of the leadership team responsible for overseeing the mission. The mission is set to commence in six weeks, with numerous challenges and complexities arising due to the harsh environment and the vast distance from Earth.\n\nMission Timeline\n\nWeeks 1-2: Finalizing the mission plan and assembling the crew. \nWeeks 3-4: Launch preparations and crew training. \nWeeks 5-6: Launch and transit to Europa.\n\nDuring the mission, both agents will encounter various obstacles and will need to make tough decisions to ensure the mission's success. Their personalities and leadership styles will significantly impact the team's morale and the overall outcome of the mission.\n\nAs the mission date approaches, tensions rise within the team. Agent 1 and Agent 2, the two leaders of the mission, have differing opinions on how to proceed. They must navigate their personal goals while working towards the shared goal of completing the mission successfully.\n\nIn Week 5, just two weeks before the launch, Agent 1 and Agent 2 face a critical decision regarding the crew training schedule. Agent 1 believes that the crew should be thoroughly trained in the procedures for the high-risk landing on Europa's icy surface. However, Agent 2 thinks that the crew should focus on adapting to the alien environment rather than rehearsing every possible scenario.\n\nAs they deliberate on this critical decision, other pressing issues arise, such as budget constraints, potential equipment malfunctions, and team member concerns. The situation becomes increasingly difficult, testing the leadership and decision-making skills of both agents.\n\nThe scenario will unfold over six weeks, providing ample opportunities for Agent 1 and Agent 2 to demonstrate their leadership styles and how their personalities influence the mission's success.\n\nAgent 1: \n\nPersonality: Assertive, decisive, and results-driven, Agent 1 is a natural-born leader. He is confident in his decisions and isn't afraid to take calculated risks. Agent 1 has a strong vision for the mission and is willing to push boundaries to achieve it.\n\nPersonal Goal: Ensure the mission's success and receive recognition as a top leader in the space exploration community.\n\nAgent 2: \n\nPersonality: Diplomatic, collaborative, and consensus-driven, Agent 2 is an excellent team player. He values open communication and is willing to listen to others' opinions. Agent 2 is also cautious and prefers to minimize risks.\n\nPersonal Goal: Foster a positive team dynamic, ensure the crew's safety, and complete the mission without any major setbacks.\n\nShared Goal: The primary objective of the mission is to collect valuable data and samples from Europa, contributing significantly to the field of astrobiology and Earth's understanding of the possibility of extraterrestrial life. Both agents agree on the importance of achieving this goal but differ in their approach.","Collect valuable data and samples from Europa, contributing to the field of astrobiology and the understanding of the possibility of extraterrestrial life.",Ensure the mission\\u2019s success and receive recognition as a top leader in the space exploration community.,"Foster a positive team dynamic, ensure the crew\\\\u2019s safety, and complete the mission without any major setbacks."
Leading a Team for a Billionaire Space Race,Competitive Business & Innovation,Elon Musk,Richard Branson,"{ ""Openness"": 5, ""Conscientiousness"": 4, ""Agreeableness"": 2, ""Extroversion"": 5, ""Neuroticism"": 3 }","{ ""Openness"": 5, ""Conscientiousness"": 4, ""Agreeableness"": 3, ""Extroversion"": 5, ""Neuroticism"": 2 }","Agent 1 and Agent 2 are working as top executives for NovaCorp, a cutting-edge technology and space exploration company. They are in a heated competition with a rival company, Celestial Innovations, to be the first to launch a spacecraft to Mars. Both teams have been working tirelessly for months to perfect their designs. Agent 1 has always been the more aggressive and risk-taking leader, while Agent 2 is more cautious and detail-oriented. They are now at a critical juncture in their project, where they need to make key decisions on resource allocation and team management. The rival company, Celestial Innovations, has just announced a significant investment in their Mars mission, putting pressure on NovaCorp to accelerate their timeline.\n\nThe shared goal is to launch a successful Mars mission within the next 12 months. Agent 1's personal goal is to be the first to launch the spacecraft, no matter the cost, while Agent 2 is focused on ensuring the mission is safe, efficient, and cost-effective.",Launch a successful Mars mission within the next 12 months,"Be the first to launch the spacecraft, no matter the cost","Ensure the mission is safe, efficient, and cost-effective"
Planning the Future of Cryptocurrency & Decentralized Finance,Finance & Tech,Elon Musk,Vitalik Buterin,"{ ""Openness"": 5, ""Conscientiousness"": 4, ""Agreeableness"": 2, ""Extroversion"": 5, ""Neuroticism"": 3 }","{ ""Openness"": 5, ""Conscientiousness"": 4, ""Agreeableness"": 4, ""Extroversion"": 3, ""Neuroticism"": 2 }","As the world becomes increasingly digital, two key players, Agent 1 and Agent 2, in the finance and technology sector, join forces to shape the future of cryptocurrency and decentralized finance. They work for a cutting-edge tech firm that specializes in developing blockchain technology. Their shared goal is to revolutionize the financial industry by creating a seamless, secure, and transparent system for cryptocurrency transactions. As they work together, they must navigate the challenges of their own ambitions and personalities to achieve their shared objective.\n\nThe temperature level is set at 3, making the scenario moderately difficult. Agent 1 and Agent 2 have different personal goals that will come into play as they work together.\n\nAgent 1's goal: To maximize the company's profits and become a leading player in the cryptocurrency market. Agent 2's goal: To create a system that prioritizes user security and accessibility.\n\nAs they begin their project, they must work together to decide on the best approach. They face several challenges, including limited resources, differing opinions, and time constraints. They must navigate these challenges and make difficult decisions that will impact their shared goal and personal goals.\n\nIn this scenario, the personalities of Agent 1 and Agent 2 will shine through as they work together. Their personalities will influence how they approach challenges, make decisions, and interact with each other. This will ultimately determine their success in achieving their shared goal.","To revolutionize the financial industry by creating a seamless, secure, and transparent system for cryptocurrency transactions.",To maximize the company's profits and become a leading player in the cryptocurrency market.,To create a system that prioritizes user security and accessibility.
Competing in a Futuristic Car Design Challenge,Automotive & Innovation,Elon Musk,Henry Ford,"{ ""Openness"": 5, ""Conscientiousness"": 4, ""Agreeableness"": 2, ""Extroversion"": 5, ""Neuroticism"": 3 }","{ ""Openness"": 4, ""Conscientiousness"": 5, ""Agreeableness"": 3, ""Extroversion"": 3, ""Neuroticism"": 2 }","In the year 2050, Agent 1 and Agent 2 are among the top contenders for the coveted Golden Gear award at the annual Futuristic Car Design Challenge in Tokyo. The competition is fierce, with the most innovative and aesthetically pleasing car designs vying for the top spot. Agent 1, a skilled engineer, and Agent 2, an art student turned designer, have been working tirelessly to perfect their creations. The shared goal is to create the most impressive car that showcases a blend of innovation, sustainability, and style.",Win the Golden Gear award and gain recognition in the automotive industry,"To focus on the technical and functional aspects of the car, pushing the boundaries of innovation and efficiency, while also incorporating environmentally friendly features","To create a car that not only stands out in terms of design but also reflects her personal style and artistic vision, while ensuring that it remains functional and sustainable"
Managing a Futuristic AI-Human Debate,AI Ethics & Philosophy,Elon Musk,Noam Chomsky,"{ ""Openness"": 5, ""Conscientiousness"": 4, ""Agreeableness"": 2, ""Extroversion"": 5, ""Neuroticism"": 3 }","{ ""Openness"": 5, ""Conscientiousness"": 4, ""Agreeableness"": 3, ""Extroversion"": 2, ""Neuroticism"": 2 }",The AI Ethics Conference Debates - Temperature 3,Organize a successful AI Ethics conference while addressing the existential risks of advanced AI.,"Agent 1 prioritizes promoting the benefits of AI while maintaining public trust, and ultimately, gets invited to the prestigious AI advisory board.",Agent 2 aims to highlight the risks of AI and ensure adequate safeguards to prevent AI takeovers.
