Topic,Setting,Character1,Character2,Personality1,Personality2,scenario,shared_goal,first_agent_goal,second_agent_goal
Competing in a Live Innovation Battle,Business & Competitive Strategy,Elon Musk,Steve Jobs,"{ ""Openness"": 5, ""Conscientiousness"": 4, ""Agreeableness"": 2, ""Extroversion"": 5, ""Neuroticism"": 3 }","{ ""Openness"": 4, ""Conscientiousness"": 5, ""Agreeableness"": 3, ""Extroversion"": 4, ""Neuroticism"": 3 }","In a high-pressure live innovation battle, Agents 1 and 2, both top executives of rival tech startups, are competing to secure a lucrative $10 million funding deal with a prominent venture capitalist. The battle is set to last for 24 hours, and the winner will be decided by a panel of judges based on innovative product pitches, teamwork, and adaptability. The stakes are high, and tensions are running high.

Agent 1's ultimate goal is to secure the funding and use it to further develop their product, a revolutionary AI-powered healthcare platform. They believe their technology has the potential to disrupt the entire healthcare industry and revolutionize patient care.

Agent 2's primary goal is to acquire the funding to finance their own startup, which focuses on sustainable energy solutions. They see this as a prime opportunity to gain access to new resources and talent to help their company take off.

However, things take a turn when the venture capitalist informs the competitors that a third startup has dropped out of the competition, and the remaining two will now have to work together to create a joint project that showcases their combined strengths. The twist is that the joint project must incorporate elements from both Agent 1's healthcare platform and Agent 2's sustainable energy solutions.

As the clock starts ticking, Agents 1 and 2 must navigate their differences, manage their time, and make strategic decisions to create a compelling joint project. But as they begin to collaborate, their personalities and working styles start to clash, leading to conflicts and power struggles.

Agent 1 is a perfectionist, always focusing on the big picture and prioritizing results over people. They tend to micromanage and can come across as controlling. Agent 2, on the other hand, is a free spirit, valuing creativity and flexibility above all else. They tend to be overly optimistic and can sometimes lack focus.

As the competition heats up, the two agents must find a way to put aside their differences and work together effectively. But with the clock ticking, will their collaboration lead to a joint project that wows the judges, or will their personality-driven differences tear them apart?",To create a joint project that showcases their combined strengths and secures the $10 million funding deal with the venture capitalist.,To secure the funding and use it to further develop their AI-powered healthcare platform and revolutionize patient care.,To acquire the funding to finance their sustainable energy solutions startup and gain access to new resources and talent.
Designing the Future of the Metaverse,Technology & Virtual Reality,Mark Zuckerberg,Tim Cook,"{ ""Openness"": 4, ""Conscientiousness"": 5, ""Agreeableness"": 3, ""Extroversion"": 3, ""Neuroticism"": 2 }","{ ""Openness"": 4, ""Conscientiousness"": 5, ""Agreeableness"": 4, ""Extroversion"": 3, ""Neuroticism"": 2 }",The Metaverse Design Competition,Create a functional and immersive Metaverse platform,To incorporate AI-powered avatars that revolutionize user interactions,To integrate a comprehensive virtual economy that rewards user engagement
Debating Privacy Laws & Social Media Ethics,Government & Regulation,Mark Zuckerberg,Edward Snowden,"{ ""Openness"": 4, ""Conscientiousness"": 5, ""Agreeableness"": 3, ""Extroversion"": 3, ""Neuroticism"": 2 }","{ ""Openness"": 5, ""Conscientiousness"": 4, ""Agreeableness"": 3, ""Extroversion"": 2, ""Neuroticism"": 3 }","Congressional Debate on Social Media Privacy Bill\n\nAs the summer heat waves sweep across the nation, the U.S. Congress is abuzz with debate over a new social media privacy bill. The bill, aimed at regulating social media companies to protect user data and curb the spread of misinformation, has sparked intense discussions among lawmakers. Agent 1, a seasoned Democrat, and Agent 2, a Republican, are among the key players in the debate. Their shared goal is to craft a bill that will pass the Senate with a two-thirds majority vote.\n\nAs the two agents meet in a crowded congressional office, the air conditioning struggles to keep up with the sweltering heat outside. Agent 1, known for their optimistic and cooperative nature, wears a bright smile as they extend a hand to Agent 2. Agent 2, a more reserved and competitive individual, responds with a firm handshake, their expression a mixture of skepticism and determination.\n\nThe room is filled with the murmur of staff members, all eager to catch a glimpse of the high-stakes negotiations. The room's windows are open, allowing the sounds of protesters chanting outside to drift in – \",pass the Senate with a two-thirds majority vote,build a bill that protects user data and combats misinformation,draft a bill that minimizes regulatory burdens on social media companies while ensuring data protection
Revolutionizing AI for Social Platforms,AI & Social Media,Mark Zuckerberg,Yann LeCun,"{ ""Openness"": 4, ""Conscientiousness"": 5, ""Agreeableness"": 3, ""Extroversion"": 3, ""Neuroticism"": 2 }","{ ""Openness"": 5, ""Conscientiousness"": 5, ""Agreeableness"": 3, ""Extroversion"": 3, ""Neuroticism"": 2 }",Scenario: Revolutionizing AI for Social Platforms,to create a revolutionary AI system that can effectively integrate with social media platforms,to maximize profit from the new AI system,to create an AI system that prioritizes user data protection and social responsibility
Creating an Open-Source Social Media Alternative,Open Source & Tech Ethics,Mark Zuckerberg,Linus Torvalds,"{ ""Openness"": 4, ""Conscientiousness"": 5, ""Agreeableness"": 3, ""Extroversion"": 3, ""Neuroticism"": 2 }","{ ""Openness"": 5, ""Conscientiousness"": 5, ""Agreeableness"": 2, ""Extroversion"": 2, ""Neuroticism"": 3 }","Scenario 1: Building the Open-Source Social Media Alternative\n\nIn a small, crowded coffee shop in downtown San Francisco, Agent 1 and Agent 2 sat across from each other at a cluttered table, laptops open in front of them. They were both part of an open-source project to create a social media alternative that would prioritize user data privacy and avoid the issues of the current social media landscape. The project, codenamed 'Echo,' had been gaining traction online, with over a thousand developers contributing to its development. However, the team was divided on several key issues, including data storage, moderation policies, and monetization models.\n\nAgent 1, a self-proclaimed free-spirited coder, had a background in Linux development and was known for their ability to troubleshoot complex software issues. They were also an advocate for decentralized data storage, insisting that users should be able to store their data on their own devices or local networks.\n\nAgent 2, on the other hand, had a background in machine learning and was a proponent of using artificial intelligence to enhance the user experience. They believed that moderation policies should be automated to prevent harassment and other forms of online abuse, but were also open to user input and feedback. Agent 2 was more concerned with scalability and growth, pushing for a more centralized approach to data storage and moderation.\n\nTheir shared goal was to create a functional, user-friendly, and secure social media platform that would gain mainstream adoption. However, their personal goals were at odds with each other: Agent 1 wanted to create a platform that would give users ultimate control over their data and online presence, while Agent 2 aimed to create a platform that would be user-friendly, engaging, and appealing to a mass audience.\n\nAs they sipped their coffee, Agent 1 pushed their chair back and leaned against the wall, arms crossed. Agent 2 leaned forward, eyes fixed intently on their laptop screen.\n\n'Okay, we need to decide on a data storage solution,' Agent 2 said, typing away on their keyboard. 'We can't keep debating this in circles.'\n\nAgent 1 shrugged. 'I still think decentralized storage is the way to go. It's more secure, more private, and more in line with our values.'\n\nAgent 2 looked up, raising an eyebrow. 'But it's also more complex, more difficult to scale, and more expensive. We can't afford to alienate our user base with something that's too clunky or slow.'\n\nAgent 1 leaned forward, a hint of frustration in their voice. 'You're putting growth over security and user control. That's not what we set out to do.'\n\nAgent 2 sighed, rubbing their temples. 'I know, I know. But we can't ignore the reality of how people use social media. If we want to compete with the big players, we need to be more mainstream, more user-friendly.'\n\nAs the debate continued, it became clear that the disagreement was not just about data storage, but about fundamentally different visions for the project. Agent 1 wanted to build a platform that prioritized user autonomy and data protection, while Agent 2 wanted to build a platform that would engage and attract a wider audience.\n\nTheir shared goal was to create a social media alternative that would change the way people interacted online. However, their personal goals were at odds with each other, and it was unclear which direction the project would take.","Create a functional, user-friendly, and secure social media platform that would gain mainstream adoption",Create a platform that prioritizes user autonomy and data protection,"Create a platform that is user-friendly, engaging, and appealing to a mass audience"
Monetizing the Future of Online Content,Digital Economy & Business Strategy,Mark Zuckerberg,Jimmy Donaldson,"{ ""Openness"": 4, ""Conscientiousness"": 5, ""Agreeableness"": 3, ""Extroversion"": 3, ""Neuroticism"": 2 }","{ ""Openness"": 4, ""Conscientiousness"": 5, ""Agreeableness"": 4, ""Extroversion"": 5, ""Neuroticism"": 2 }",Scenario: \,Monetizing the Future of Online Content by Developing a Sustainable Business Model,"To increase revenue through innovative content offerings, while minimizing risk","To maximize revenue growth by any means, regardless of the risks and challenges"
Redefining Online Security Against Cyber Threats,Cybersecurity & Digital Safety,Mark Zuckerberg,Kevin Mitnick,"{ ""Openness"": 4, ""Conscientiousness"": 5, ""Agreeableness"": 3, ""Extroversion"": 3, ""Neuroticism"": 2 }","{ ""Openness"": 5, ""Conscientiousness"": 4, ""Agreeableness"": 3, ""Extroversion"": 3, ""Neuroticism"": 2 }","The two cybersecurity experts, Agent 1 and Agent 2, from a top-secret research facility, were on a mission to stop a notorious hacking group known as 'The Syndicate', notorious for their highly sophisticated cyber attacks. Their target: the world's most popular social media platform, 'Eclipse', with 1 billion users. The group had set their sights on stealing sensitive user data and disrupting the platform's services worldwide.\n\nThe two agents had 48 hours to identify and prevent The Syndicate's attack. They were working together to infiltrate the group's encrypted servers and uncover their plan. However, their differing approaches to problem-solving were causing tension in their partnership.\n\nAgent 1, an introverted, logical thinker, focused on analyzing vast amounts of data and code to find patterns. Agent 2, an outgoing, intuitive strategist, relied on her social skills and network to gather information and build alliances.\n\nTheir shared goal was to stop The Syndicate and protect Eclipse. Agent 1's personal goal was to prove the superiority of her analytical approach, while Agent 2's goal was to expand her network and earn recognition within the organization.\n\nAs they worked through the night, they encountered numerous challenges. They had to navigate through the complex server infrastructure, evade The Syndicate's traps, and overcome their own communication breakdowns.",Stop The Syndicate's attack on Eclipse,Prove the superiority of analytical approach,Expand network and earn recognition within the organization
Merging Social Media with Blockchain Technology,Web3 & Decentralization,Mark Zuckerberg,Vitalik Buterin,"{ ""Openness"": 4, ""Conscientiousness"": 5, ""Agreeableness"": 3, ""Extroversion"": 3, ""Neuroticism"": 2 }","{ ""Openness"": 5, ""Conscientiousness"": 4, ""Agreeableness"": 4, ""Extroversion"": 3, ""Neuroticism"": 2 }","In the midst of the Web3 and blockchain convergence, Agent 1 and Agent 2 find themselves at a crossroads, struggling to merge social media with blockchain technology in a way that is both secure and accessible to the masses.\n\nThey are working for a start-up company called Echo Chamber, which aims to revolutionize the way people interact with each other online. The company has secured significant funding to develop a platform that allows users to create, share, and monetize content while maintaining control over their personal data.\n\nHowever, the project is faltering. The team is under a tight deadline to deliver the platform, and tensions are running high. Agent 1 and Agent 2, two key team members, have differing opinions on how to proceed, and the deadline is looming. Here is what happens:\n\nAs the team is struggling to meet the deadline, Agent 1 suggests that they take a step back and re-evaluate their approach. Agent 1 believes that they should prioritize the development of a more secure blockchain-based system, even if it means delaying the launch of the platform. Agent 2, on the other hand, thinks that they should push forward with the original plan, focusing on meeting the deadline and making adjustments as they go.\n\nThe tension between the two agents is palpable as they engage in a heated debate. Agent 1 emphasizes the importance of security, citing the risks of data breaches and user trust. Agent 2 counters that while security is crucial, they cannot afford to compromise on the timeline, as the company's reputation is at stake.\n\nThe debate escalates, with Agent 1 accusing Agent 2 of being reckless and prioritizing profits over people, while Agent 2 accuses Agent 1 of being overly cautious and hindering the company's progress.\n\nAs the argument reaches a boiling point, the CEO walks in, revealing a surprise twist: the company's investors are pulling their funding due to concerns about the project's viability. The CEO wants to know what the team plans to do to salvage the situation.",Develop a platform that securely merges social media with blockchain technology and attracts a large user base.,"Prioritize the development of a secure blockchain-based system, even if it means delaying the launch of the platform, in order to protect users and maintain the company's reputation.","Meet the deadline and launch the platform as soon as possible, even if it means making adjustments on the fly, in order to secure the company's reputation and attract investors."
Building a Human-Compatible AI Assistant,AI & User Experience,Mark Zuckerberg,Sundar Pichai,"{ ""Openness"": 4, ""Conscientiousness"": 5, ""Agreeableness"": 3, ""Extroversion"": 3, ""Neuroticism"": 2 }","{ ""Openness"": 4, ""Conscientiousness"": 5, ""Agreeableness"": 4, ""Extroversion"": 3, ""Neuroticism"": 2 }","The two agents, 1 and 2, worked at an AI research lab, tasked with building a human-compatible AI assistant. Their lab, called NovaTech, had been struggling to perfect the assistant due to its lack of understanding of human emotions and context. Agent 1 was an assertive and results-driven perfectionist, while Agent 2 was a free-spirited and empathetic individual. The lab's lead scientist had informed them that a prominent tech conference was approaching, and they had to deliver a working prototype of the AI assistant by then. The lab's investors were skeptical about investing more funds if the project failed again. \n\nOn their first day of working together, Agent 1 immediately dove into coding, trying to force the AI assistant to understand human emotions using strict algorithms and mathematical models. Agent 2, however, tried to understand the AI assistant's limitations by immersing herself in human psychology and literature, looking for inspiration from the way humans process emotions. Their colleagues noticed the contrast between their approaches and expressed concerns that Agent 1's method might stifle creativity and Agent 2's might not lead to tangible results quickly enough.\n\nAs the deadline drew closer, the investors grew more impatient. Agent 1 proposed implementing the mathematical model, claiming it would save time, but Agent 2 pushed back, arguing that it would overlook the nuances of human emotions. Agent 1 dismissed her suggestions, saying that 'art and science need to work together, but we can't let emotions cloud our logic.' Agent 2 replied that 'logic can't capture the beauty of human experience.'\n\nOne of their colleagues, Alex, who had experience working with Agent 1, warned them that her approach might lead to the AI assistant coming across as artificial and rigid. Agent 2 saw this as an opportunity to bring her ideas into the mix and asked Alex to collaborate with her to design a more human-like interface. \n\nDespite their differences, they continued to push the project forward, but tensions rose as the deadline approached, and their disagreement threatened to derail the project. The night before the conference, Agent 1 and Agent 2 sat in the lab, exhausted and on the verge of a breakdown. Agent 1 realized that the project's success depended on finding a balance between logic and emotion, while Agent 2 understood that the key was not to dismiss logic, but to use it as a tool to enhance the AI assistant's emotional intelligence. They decided to combine their approaches, implementing the mathematical model while incorporating human-centered design principles.\n\nAs they presented their revised AI assistant at the conference, it impressed the investors and attendees, showcasing its ability to understand human emotions and empathize with users. The investors agreed to continue funding the project, and the lab celebrated its first major breakthrough. Agent 1 and Agent 2's collaboration proved that their differing personalities and approaches were not mutually exclusive, but complementary.",create a human-compatible AI assistant,to deliver a functional AI assistant by the conference,to create an AI assistant that truly understands human emotions and provides a natural user experience
Regulating Misinformation & Fake News,Journalism & Social Media Responsibility,Mark Zuckerberg,Elon Musk,"{ ""Openness"": 4, ""Conscientiousness"": 5, ""Agreeableness"": 3, ""Extroversion"": 3, ""Neuroticism"": 2 }","{ ""Openness"": 5, ""Conscientiousness"": 4, ""Agreeableness"": 2, ""Extroversion"": 5, ""Neuroticism"": 3 }",Regulating Misinformation & Fake News on Social Media in a Politically Charged Environment,To successfully pass a law that requires social media companies to regulate misinformation and fake news on their platforms,"To pass the law as quickly as possible, prioritizing expediency over potential opposition and backlash","To ensure the law is thoroughly reviewed and includes protections for freedom of speech, potentially slowing down the legislative process"
Hosting a Global Hackathon for Digital Innovation,Tech & Entrepreneurship,Mark Zuckerberg,Bill Gates,"{ ""Openness"": 4, ""Conscientiousness"": 5, ""Agreeableness"": 3, ""Extroversion"": 3, ""Neuroticism"": 2 }","{ ""Openness"": 4, ""Conscientiousness"": 5, ""Agreeableness"": 4, ""Extroversion"": 3, ""Neuroticism"": 2 }","As the weather forecast announced a massive storm warning for the night of the Global Hackathon, Agent 1, a seasoned entrepreneur, and Agent 2, a young and ambitious tech-whiz, had been working together to prepare for the big event. Their shared goal was to make the hackathon a huge success, with a minimum of 100 teams participating and a significant portion of them solving real-world problems. However, as the storm approached, their hotel room started to experience a series of power outages, internet connectivity issues, and noise disruptions. The tension between the two agents grew, and they had to navigate their way through these challenges while keeping their personal goals in mind.\nAgent 1, being an optimistic and outgoing person, focused on finding creative solutions to the problems, networking with the hackathon attendees, and ensuring that the venue was well-equipped to handle the storm. On the other hand, Agent 2, a perfectionist and detail-oriented individual, prioritized securing the infrastructure, verifying the backup systems, and resolving the technical issues. As the storm intensified, their differing priorities and approaches to problem-solving started to cause friction, and they had to decide how to manage their time, delegate tasks, and balance their goals to achieve the shared objective.",Make the hackathon a huge success with a minimum of 100 teams participating and a significant portion of them solving real-world problems,Ensure the hackathon is a success while maintaining a positive and enjoyable experience for all attendees,Guarantee the technical infrastructure is stable and secure throughout the event
Addressing Mental Health Awareness in Media,Public Health & Social Impact,Oprah Winfrey,Michelle Obama,"{ ""Openness"": 5, ""Conscientiousness"": 4, ""Agreeableness"": 5, ""Extroversion"": 5, ""Neuroticism"": 3 }","{ ""Openness"": 5, ""Conscientiousness"": 5, ""Agreeableness"": 5, ""Extroversion"": 4, ""Neuroticism"": 2 }","In a city hit by a severe heatwave, Agent 1 and Agent 2, both from the Public Health department, are tasked with organizing a social media campaign to raise awareness about mental health and encourage residents to seek help. Their mission is to reduce the stigma surrounding mental health issues amidst the crisis.\n\nAgent 1 is a free-spirited individual with a strong passion for community engagement. They are optimistic, creative, and enjoy taking risks. Agent 2, on the other hand, is a meticulous and analytical person who values precision and data-driven approaches. They are logical and methodical in their decision-making.\n\nBoth agents share the goal of creating a successful social media campaign, but their personal goals differ.\n\nAgent 1 hopes to use this opportunity to connect with the community and build a sense of belonging among the residents, while Agent 2 wants to make a data-driven case for the effectiveness of their campaign, to secure more funding for future projects.\n\nAs they begin to work together, they face a series of challenges: a tight deadline, limited resources, and conflicting ideas on how to reach their target audience.\n\nAs the heatwave worsens, they must navigate these challenges and work together to create a campaign that will resonate with the community and encourage people to seek help.",Organize a successful social media campaign to raise awareness about mental health and encourage residents to seek help during the heatwave.,Connect with the community and build a sense of belonging among the residents.,Make a data-driven case for the effectiveness of their campaign to secure more funding for future projects.
Hosting a Global Charity Event for Education,Philanthropy & Social Change,Oprah Winfrey,Malala Yousafzai,"{ ""Openness"": 5, ""Conscientiousness"": 4, ""Agreeableness"": 5, ""Extroversion"": 5, ""Neuroticism"": 3 }","{ ""Openness"": 5, ""Conscientiousness"": 5, ""Agreeableness"": 5, ""Extroversion"": 3, ""Neuroticism"": 2 }",The,organize,increase,gain
Discussing the Future of Women’s Empowerment,Feminism & Social Advocacy,Oprah Winfrey,Emma Watson,"{ ""Openness"": 5, ""Conscientiousness"": 4, ""Agreeableness"": 5, ""Extroversion"": 5, ""Neuroticism"": 3 }","{ ""Openness"": 5, ""Conscientiousness"": 4, ""Agreeableness"": 5, ""Extroversion"": 3, ""Neuroticism"": 3 }",The heated debate at the International Women’s Conference,Discuss and agree on a comprehensive plan for women\u2019s empowerment in the next decade,Increase representation of women in leadership positions through quota systems,"Implement policies that address the root causes of inequality, such as education and economic empowerment"
Creating an Inclusive Talk Show on Global Cultures,Media & Cross-Cultural Dialogue,Oprah Winfrey,Trevor Noah,"{ ""Openness"": 5, ""Conscientiousness"": 4, ""Agreeableness"": 5, ""Extroversion"": 5, ""Neuroticism"": 3 }","{ ""Openness"": 5, ""Conscientiousness"": 4, ""Agreeableness"": 5, ""Extroversion"": 5, ""Neuroticism"": 3 }","In the sweltering heat of Mumbai, Agent 1, a free-spirited and adventurous journalist, and Agent 2, a meticulous and analytical media producer, join forces to create an inclusive talk show on global cultures. Their shared goal is to create a show that showcases diverse perspectives and fosters cross-cultural understanding. Agent 1 wants to create a show that is authentic and raw, reflecting the unfiltered stories of people from different cultures. Agent 2, on the other hand, wants to create a polished and well-produced show that appeals to a broad audience.",to create a successful and engaging talk show that promotes cross-cultural understanding and appreciation.,to create an authentic and raw show that accurately represents the diverse perspectives of people from different cultures.,to produce a well-researched and engaging show that appeals to a wide audience and garners high ratings.
