Topic,Setting,Character1,Character2,Personality1,Personality2,scenario,shared_goal,first_agent_goal,second_agent_goal
Writing a Bestseller on Overcoming Life Challenges,Publishing & Inspirational Storytelling,Oprah Winfrey,J.K. Rowling,"{ ""Openness"": 5, ""Conscientiousness"": 4, ""Agreeableness"": 5, ""Extroversion"": 5, ""Neuroticism"": 3 }","{ ""Openness"": 5, ""Conscientiousness"": 5, ""Agreeableness"": 4, ""Extroversion"": 3, ""Neuroticism"": 4 }","In the midst of a fierce storm, two writers, AGENT 1 and AGENT 2, were stranded on a remote island with a rickety cabin as their only shelter. The storm outside grew more intense by the minute, and their chances of survival hung precariously in the balance. They knew they had to work together to survive, but their vastly different personalities made their collaboration a potentially volatile equation. Agent 1, an introverted writer with a background in psychology, was analytical and meticulous. Agent 2, an extroverted writer with a background in sales, was charismatic and impulsive. Their shared goal was to survive the night and find a way off the island, but their personal goals were at odds with one another. Agent 1 wanted to use the experience as a catalyst for her next novel, while Agent 2 saw the opportunity as a chance to create a bestselling memoir about overcoming adversity. As the storm raged on, they had to navigate their differences to stay alive and achieve their shared goal, but their conflicting objectives created tension and obstacles that threatened to tear them apart. With each passing hour, their situation grew more desperate, and their personalities more tested.",Survive the storm and find a way off the island,Use the experience as a catalyst for her next novel,Create a bestselling memoir about overcoming adversity
Launching a Mental Wellness App for Women,Tech & Wellness,Oprah Winfrey,Arianna Huffington,"{ ""Openness"": 5, ""Conscientiousness"": 4, ""Agreeableness"": 5, ""Extroversion"": 5, ""Neuroticism"": 3 }","{ ""Openness"": 5, ""Conscientiousness"": 5, ""Agreeableness"": 4, ""Extroversion"": 3, ""Neuroticism"": 2 }","Agent 1 and Agent 2, both co-founders of a startup, aim to launch a mental wellness app tailored for women. The company, \",achieve financial success with the app,"Agent 1: ensure the app prioritizes user experience and emotional intelligence, becoming a leader in the market.","Agent 2: prioritize profit margins, ensuring the company’s financial stability, even if it means cutting costs on features."
Hosting a Panel on Overcoming Trauma & Healing,Psychology & Personal Growth,Oprah Winfrey,Brené Brown,"{ ""Openness"": 5, ""Conscientiousness"": 4, ""Agreeableness"": 5, ""Extroversion"": 5, ""Neuroticism"": 3 }","{ ""Openness"": 5, ""Conscientiousness"": 4, ""Agreeableness"": 5, ""Extroversion"": 4, ""Neuroticism"": 3 }",The Panel on Overcoming Trauma & Healing,"Host a successful panel discussion on overcoming trauma and healing, with a high level of engagement and emotional safety for all participants.","To create a comfortable and intimate atmosphere for the audience, ensuring they feel safe to share their stories and connect with others who have gone through similar experiences.","To deliver a data-driven presentation on the latest research and findings on trauma and healing, and establish the panel as a thought leader in the field of psychology and personal growth."
Producing a Netflix Documentary on Racism & Justice,Social Activism & Media Production,Oprah Winfrey,Ava DuVernay,"{ ""Openness"": 5, ""Conscientiousness"": 4, ""Agreeableness"": 5, ""Extroversion"": 5, ""Neuroticism"": 3 }","{ ""Openness"": 5, ""Conscientiousness"": 4, ""Agreeableness"": 5, ""Extroversion"": 4, ""Neuroticism"": 3 }",Scenario 1: The Documentary Debacle,Producing a thought-provoking Netflix documentary on racism and justice that sparks meaningful conversations and promotes social change,"To create a documentary that is both informative and entertaining, showcasing a balanced perspective on the issue, and achieving high viewership numbers","To create a documentary that highlights the harsh realities of systemic racism and pushes for concrete actions and policy changes, while also gaining critical acclaim and awards"
Organizing a Live Event for Spiritual Awakening,Spirituality & Personal Transformation,Oprah Winfrey,Deepak Chopra,"{ ""Openness"": 5, ""Conscientiousness"": 4, ""Agreeableness"": 5, ""Extroversion"": 5, ""Neuroticism"": 3 }","{ ""Openness"": 5, ""Conscientiousness"": 4, ""Agreeableness"": 5, ""Extroversion"": 3, ""Neuroticism"": 2 }",Organizing a Live Event for Spiritual Awakening Under Challenging Circumstances,to host a successful and transformative live event for spiritual awakening that attracts a large audience,to create a unique and immersive experience that sets a new standard for spiritual events while maximizing profits,to create a safe and inclusive space for attendees to connect with their inner selves and the community
Hosting a Roundtable on Leadership & Legacy,Leadership & Motivation,Oprah Winfrey,Indra Nooyi,"{ ""Openness"": 5, ""Conscientiousness"": 4, ""Agreeableness"": 5, ""Extroversion"": 5, ""Neuroticism"": 3 }","{ ""Openness"": 4, ""Conscientiousness"": 5, ""Agreeableness"": 4, ""Extroversion"": 3, ""Neuroticism"": 2 }",The,organizing,maximizing,protecting
