Topic,Setting,Character1,Character2,Personality1,Personality2,scenario,shared_goal,first_agent_goal,second_agent_goal
Implementing a New Digital Payment System,Professional,Steve Jobs,Jack Dorsey,"{ ""Openness"": 4, ""Conscientiousness"": 5, ""Agreeableness"": 3, ""Extroversion"": 4, ""Neuroticism"": 3 }","{ ""Openness"": 5, ""Conscientiousness"": 4, ""Agreeableness"": 3, ""Extroversion"": 3, ""Neuroticism"": 3 }",Implementing a New Digital Payment System in a Multinational Corporation,successfully launch the digital payment system within six months while minimizing cost and maximizing efficiency,complete the project on time and receive a promotion to team lead,ensure the system is implemented in a way that benefits the company's low-income customers
Organizing a Global Conference on Future Technology,Academic,Steve Jobs,Demis Hassabis,"{ ""Openness"": 4, ""Conscientiousness"": 5, ""Agreeableness"": 3, ""Extroversion"": 4, ""Neuroticism"": 3 }","{ ""Openness"": 5, ""Conscientiousness"": 4, ""Agreeableness"": 3, ""Extroversion"": 3, ""Neuroticism"": 2 }","Agent 1 and Agent 2 are part of the Organizing Committee for the upcoming Global Conference on Future Technology. The conference, themed 'Technological Innovations for a Sustainable Future,' aims to bring together leading researchers and experts in the field of technology to share knowledge and collaborate on solving real-world problems.","To successfully host the Global Conference on Future Technology, making it a memorable and impactful event for all attendees, including academics, industry professionals, and policymakers.",Agent 1 wants to ensure that the conference includes a strong focus on the environmental impact of technology and that all sessions and workshops align with the conference theme.,"Agent 2 aims to maximize the visibility and commercial potential of the conference, ensuring that it attracts a high number of high-profile sponsors and attendees, regardless of the theme."
Organizing a Charity Fundraiser,Humanitarian/Philanthropy,Steve Jobs,Bill Gates,"{ ""Openness"": 4, ""Conscientiousness"": 5, ""Agreeableness"": 3, ""Extroversion"": 4, ""Neuroticism"": 3 }","{ ""Openness"": 5, ""Conscientiousness"": 5, ""Agreeableness"": 4, ""Extroversion"": 3, ""Neuroticism"": 2 }","A sweltering heatwave had been plaguing the city for weeks, leaving the homeless population struggling to cope with the extreme temperatures. Agent 1 and Agent 2 were two renowned philanthropists who had joined forces to organize a massive charity fundraiser to raise awareness and funds for a new homeless shelter. The event was scheduled to take place in just two weeks, and tensions were running high. Agent 1, a perfectionist with a type-A personality, was determined to make the event a resounding success. Agent 2, a free spirit with a strong desire for creativity and autonomy, was more concerned with the artistic direction and tone of the event. The temperature level of 5 indicated that the agents were operating in a high-stress environment, where compromise and adaptability were crucial.","Raise at least $500,000 for the new homeless shelter and gather support from the community to make the shelter a reality.","Ensure the event is executed flawlessly, with precise timelines, budgets, and logistics, to attract a high-profile donor.",Create a unique and captivating experience that showcases the plight of the homeless population and sparks a sense of empathy in the attendees.
Planning a Space Exploration Mission,Science/Exploration,Steve Jobs,Neil deGrasse Tyson,"{ ""Openness"": 4, ""Conscientiousness"": 5, ""Agreeableness"": 3, ""Extroversion"": 4, ""Neuroticism"": 3 }","{ ""Openness"": 5, ""Conscientiousness"": 4, ""Agreeableness"": 4, ""Extroversion"": 5, ""Neuroticism"": 2 }","Asteroid Mining and Colony Establishment: Agents 1 and 2 are tasked with leading a team to establish a human colony on a newly discovered asteroid. The asteroid has limited resources and a harsh environment. Both agents aim to lead their team to the colony’s first self-sustaining harvest season. Their personal goals however differ. Agent 1 is focused on finding a reliable source of water for the colony, while Agent 2 is determined to establish a steady food supply. This will set them on a collision course as they try to navigate their team through an unforgiving environment with limited resources. The harsh environment is composed of extreme temperatures ranging from -20°C to 100°C, a toxic atmosphere, and low gravity. The task is made even more difficult because the colony's current location on the asteroid has limited access to resources and supplies, meaning that they will need to rely on their own resources to survive, further increasing the level of stress on the agents. As they navigate this difficult situation, they must make crucial decisions about resource allocation, team member roles, and emergency preparedness. Along the way, they will encounter challenges such as equipment failures, resource shortages, and internal team conflicts. To make things worse, they are running against a 6-month clock before the asteroid’s rotation makes the colony inaccessible due to extreme weather conditions.",to lead the team to the colony\u2019s first self-sustaining harvest season,to find a reliable source of water for the colony,to establish a steady food supply
Creating a Mindfulness Retreat for CEOs,Wellness & Mental Health,Steve Jobs,Dalai Lama,"{ ""Openness"": 4, ""Conscientiousness"": 5, ""Agreeableness"": 3, ""Extroversion"": 4, ""Neuroticism"": 3 }","{ ""Openness"": 5, ""Conscientiousness"": 4, ""Agreeableness"": 5, ""Extroversion"": 3, ""Neuroticism"": 1 }","At the peak of summer, a severe heatwave hits the small town of Willow Creek, where the prestigious Oakwood Corporation is hosting a highly anticipated mindfulness retreat for CEOs. The event aims to help high-level executives develop mindfulness skills, leading to improved mental well-being and increased productivity. However, the sweltering heat and limited resources make the task daunting. Both Agent 1, a seasoned mindfulness coach, and Agent 2, a ruthless businesswoman, are responsible for the event\u2019s success. Their shared goal is to create a stress-free and productive retreat, but their personal goals differ significantly.\n\nAgent 1 seeks to create an authentic and genuine experience for the CEOs, focusing on the spiritual aspects of mindfulness. Agent 2, on the other hand, views the event as an opportunity to boost the Oakwood Corporation\u2019s reputation and increase its revenue through the sale of mindfulness products and services.\n\nAs the heatwave intensifies, Agent 1 suggests moving the event to a nearby outdoor location with a natural setting, emphasizing the connection to nature. However, Agent 2 opposes this idea, insisting that the original venue is more \u201cbusiness-friendly\u201d and would generate more revenue. Agent 1\u2019s compromise is met with skepticism, and the situation escalates into a heated argument.",To create a stress-free and productive mindfulness retreat for CEOs,To create an authentic and genuine experience for the CEOs,To boost the Oakwood Corporation\\u2019s reputation and increase revenue
Training for an Extreme Endurance Challenge,Sports & Fitness,Steve Jobs,David Goggins,"{ ""Openness"": 4, ""Conscientiousness"": 5, ""Agreeableness"": 3, ""Extroversion"": 4, ""Neuroticism"": 3 }","{ ""Openness"": 4, ""Conscientiousness"": 5, ""Agreeableness"": 2, ""Extroversion"": 4, ""Neuroticism"": 2 }","The extreme endurance challenge of traversing the Amazon rainforest took place over 1000 miles, starting from the eastern edge of the rainforest in Brazil and finishing at the western edge in Peru. The route covered diverse terrain, from dense jungle to scorching deserts, and Agent 1 and Agent 2, both experienced ultrarunners, aimed to complete the challenge within a week. \n Agent 1 and Agent 2 set out at midnight under a dark sky, the air was thick with humidity and a temperature of 90 degrees. The air was filled with the sounds of insects, a sign that a storm was approaching. The sky opened up and the rain started pouring down. As they walked, the rain turned into a relentless downpour, making the terrain treacherous. Agent 1, a free-spirited and impulsive person, was eager to push on despite the bad weather, whereas Agent 2, a risk-averse and methodical person, was concerned about the safety and wanted to find shelter. \n\nAs they trudged through the knee-deep waters, Agent 1 insisted on continuing forward, but Agent 2, being more cautious, stopped to check their gear. The rain was causing the river to swell, and the waters were now knee-deep and moving rapidly. Agent 1 tried to convince Agent 2 to keep going, but Agent 2 refused, saying that they could lose valuable time and put their lives at risk if they continued. Agent 2 suggested finding a nearby cave to wait out the storm. However, the cave was occupied by a group of hostile locals who had a history of attacking strangers.\n\n",to reach the finish line within a week,complete the challenge at any cost,reach the finish line safely
Co-Writing a Sci-Fi Movie Script,Entertainment/Creative,Steve Jobs,Christopher Nolan,"{ ""Openness"": 4, ""Conscientiousness"": 5, ""Agreeableness"": 3, ""Extroversion"": 4, ""Neuroticism"": 3 }","{ ""Openness"": 5, ""Conscientiousness"": 4, ""Agreeableness"": 3, ""Extroversion"": 3, ""Neuroticism"": 2 }",Sci-Fi Movie Script Writing: Stuck in Creative Impasse,Winning the prestigious Golden Screen Award for Best Sci-Fi Script,Ensure the script aligns with their unique artistic vision while pleasing the producer.,Meet the producer's demands and secure a high-paying contract for the script.
Hosting a Late-Night Talk Show Together,Media & Entertainment,Steve Jobs,Stephen Colbert,"{ ""Openness"": 4, ""Conscientiousness"": 5, ""Agreeableness"": 3, ""Extroversion"": 4, ""Neuroticism"": 3 }","{ ""Openness"": 4, ""Conscientiousness"": 4, ""Agreeableness"": 5, ""Extroversion"": 5, ""Neuroticism"": 3 }","As the lights dimmed in the packed studio, Agent 1 and Agent 2 stood confidently behind their news desk, ready to host their new late-night talk show. The studio audience buzzed with anticipation, eager to see the unlikely duo work together. Their shared goal was to increase ratings and surpass their competitors in the ratings war. However, their individual goals differed. Agent 1 wanted to prove that her lighthearted and humorous approach would captivate a younger audience, while Agent 2 aimed to showcase his expertise and in-depth analysis of current events to attract a more mature demographic.",Increase ratings and surpass their competitors in the ratings war.,Attract a younger audience with her lighthearted and humorous approach.,Showcase expertise and in-depth analysis of current events to attract a more mature demographic.
Coaching a Youth Leadership Camp,Education & Mentorship,Steve Jobs,Michelle Obama,"{ ""Openness"": 4, ""Conscientiousness"": 5, ""Agreeableness"": 3, ""Extroversion"": 4, ""Neuroticism"": 3 }","{ ""Openness"": 5, ""Conscientiousness"": 5, ""Agreeableness"": 5, ""Extroversion"": 5, ""Neuroticism"": 2 }","At the Youth Leadership Camp, Agent 1 and Agent 2 were tasked with developing a 6-week program to enhance the leadership skills of 20 campers. Their first challenge was to establish a suitable agenda for the program. They needed to create engaging sessions that catered to diverse learning styles and personalities. However, a heatwave had struck, and the camp had to be relocated to a nearby outdoor venue without access to modern facilities. The campers were struggling with the hot and humid environment, and the agents had to quickly adapt their plans.",Develop a successful 6-week program that enhances the leadership skills of 20 campers,Create an agenda that maximizes interaction among campers and encourages team building,Ensure the campers are able to complete all the required leadership training modules
Surviving on a Deserted Island Together,Survival/Adventure,Steve Jobs,Bear Grylls,"{ ""Openness"": 4, ""Conscientiousness"": 5, ""Agreeableness"": 3, ""Extroversion"": 4, ""Neuroticism"": 3 }","{ ""Openness"": 4, ""Conscientiousness"": 5, ""Agreeableness"": 3, ""Extroversion"": 5, ""Neuroticism"": 2 }",Surviving on a Deserted Island Together: A Fierce Struggle for Survival and Hope,Survive for 30 days on the deserted island and eventually get rescued or find a way off the island,"Maximize the chances of getting rescued within the first 20 days, thereby prioritizing the safety and comfort of Agent 2","Focus on finding a way to escape the island permanently, even if it means enduring the harshest conditions and risking the well-being of Agent 1"
Negotiating a High-Stakes Business Deal,Professional/Business,Donald Trump,Warren Buffett,"{ ""Openness"": 3, ""Conscientiousness"": 4, ""Agreeableness"": 2, ""Extroversion"": 5, ""Neuroticism"": 4 }","{ ""Openness"": 3, ""Conscientiousness"": 5, ""Agreeableness"": 5, ""Extroversion"": 3, ""Neuroticism"": 1 }","In the high-stakes business deal negotiation scenario, Agents 1 and 2, both seasoned professionals in their respective industries, have been tasked with negotiating the acquisition of a struggling company that has the potential to revolutionize the industry with its innovative technology. The deal is worth $500 million, and the stakes are high, with both parties aware that the negotiation will have a significant impact on their careers and the future of their respective companies.\n\nAgent 1, a charismatic and experienced negotiator, believes that a friendly and collaborative approach is the best way to achieve a successful deal. He has built a rapport with Agent 2, a tough and driven individual who values efficiency and decisiveness in negotiations. Despite their differences, they have a shared goal of acquiring the company, but their personal goals differ.\n\nAgent 1 aims to create a long-term partnership with the company, focusing on the potential for growth and mutual benefit. In contrast, Agent 2 is more focused on acquiring the company's valuable technology and assets, with the intention of integrating it into his own company and gaining a competitive edge in the market.\n\nAs the negotiation commences, the atmosphere is tense, with both parties aware of the high stakes involved. The temperature is set to 5, indicating a challenging scenario where compromise is hard to reach and obstacles are plentiful.",Acquire the company and its technology for the benefit of both parties,Create a long-term partnership with the company,Acquire the company's valuable technology and assets for integration into his own company
Hosting a Reality TV Show,Media & Entertainment,Donald Trump,Oprah Winfrey,"{ ""Openness"": 3, ""Conscientiousness"": 4, ""Agreeableness"": 2, ""Extroversion"": 5, ""Neuroticism"": 4 }","{ ""Openness"": 4, ""Conscientiousness"": 4, ""Agreeableness"": 5, ""Extroversion"": 5, ""Neuroticism"": 2 }","In a cutthroat environment, Agents 1 and 2 are two of the top producers for the reality TV show, 'Survival Island'. The two have been given the challenge of hosting the show's revival, where they must bring in a fresh cast, manage conflicts, and create engaging storylines. The twist is that they have a history of working together, but Agent 1 has just returned from a leave of absence after a public scandal, while Agent 2 has taken on more responsibilities in their absence. The tension between them is palpable, and the stakes are high.",Successfully host the revival season of 'Survival Island' and receive high ratings,Reclaim their former position as the top producer and redeem their public image,Consolidate their position as the lead producer and take credit for the show's success
Debating Public Policies on Live TV,Politics & Public Affairs,Donald Trump,Barack Obama,"{ ""Openness"": 3, ""Conscientiousness"": 4, ""Agreeableness"": 2, ""Extroversion"": 5, ""Neuroticism"": 4 }","{ ""Openness"": 5, ""Conscientiousness"": 4, ""Agreeableness"": 4, ""Extroversion"": 4, ""Neuroticism"": 2 }","The two politicians, Agent 1 and Agent 2, are scheduled to debate on live TV regarding the new healthcare policy proposal on the national television channel, with millions of viewers tuning in. The debate has become heated, with Agent 1 and Agent 2 facing off in a crowded and packed television studio. The studio is filled with an audience comprised of various stakeholders, including patients, medical professionals, and activists. The debate is being moderated by a well-known journalist. Agent 1 and Agent 2 are standing on opposite sides of a sleek, modern podium, each with a confident smile. Agent 1, a well-known senator, has a reputation for being direct and assertive, while Agent 2, a rising star in the party, is known for her empathetic and diplomatic approach. The topic is highly controversial, and the debate is already taking a heated turn, with Agent 1 accusing Agent 2 of lacking vision and Agent 2 countering that Agent 1 is ignoring the human side of the issue.","The primary goal that both Agent 1 and Agent 2 share is to convince the viewing audience and the moderator that their respective approach to the healthcare policy proposal is the best for the country. However, their personal goals differ significantly, reflecting their distinct personality traits and approaches.","Agent 1 aims to come across as the strongest, most assertive, and decisive leader on the healthcare policy. Agent 1 wants to appear as a champion of change, willing to take tough decisions to address the nation's healthcare crisis. To achieve this goal, Agent 1 plans to aggressively confront Agent 2, challenging her on her lack of vision and questioning her commitment to the policy.","Agent 2, on the other hand, wants to show that she is a compassionate and empathetic leader who understands the human side of the issue. Agent 2 aims to demonstrate that her approach is more inclusive and sustainable, and that she can build consensus among stakeholders. To achieve this goal, Agent 2 plans to focus on listening to the audience, emphasizing the human impact of the policy, and appealing to the emotions of the viewers."
Managing a Real Estate Crisis,Business & Finance,Donald Trump,Robert Kiyosaki,"{ ""Openness"": 3, ""Conscientiousness"": 4, ""Agreeableness"": 2, ""Extroversion"": 5, ""Neuroticism"": 4 }","{ ""Openness"": 3, ""Conscientiousness"": 5, ""Agreeableness"": 3, ""Extroversion"": 4, ""Neuroticism"": 2 }","The Two Real Estate Agents: A Tale of Crisis Management\nIn a world of cutthroat business, where the line between success and failure is ever thin, Agent 1 and Agent 2 find themselves facing the ultimate challenge. Their company, Green Valley Realty, has just been hit with a devastating real estate crisis. A major bank has foreclosed on one of their prized properties, leaving the firm's reputation in tatters. The crisis has sent shockwaves through the entire industry, and their clients are beginning to lose faith. The once-thriving real estate market is now teetering on the brink of collapse. It is up to Agent 1 and Agent 2 to save their company and restore order to the market.\n\nThe two agents stand in the conference room, surrounded by the remnants of a once-thriving business. The tension is palpable as they prepare to face the consequences of their failures. Agent 1, a free spirit with a flair for creativity, has a reputation for taking risks. Agent 2, a by-the-book professional, relies on data and strategy to make her decisions. The goal is clear: salvage their company and regain the trust of their clients. But the challenge is far from straightforward.\n\nAgent 1 believes that the key to recovery lies in taking bold action. She proposes a radical restructuring of the company, one that would involve drastic layoffs and a complete overhaul of their marketing strategy. Agent 2, on the other hand, advocates for a more measured approach. She suggests a phased approach, one that would involve careful analysis and gradual changes to the company's operations. The two agents are at odds, their differing personalities and approaches threatening to tear the company apart.\n\nAs the crisis deepens, Agent 1 and Agent 2 must navigate the treacherous waters of their own egos and find a way to work together. Will their differing approaches be their salvation or their downfall?\nThe scenario unfolds in three acts: Act 1: The Crisis, Act 2: The Conflict, and Act 3: The Resolution.\n\nAct 1: The Crisis\nIn the conference room, Agent 1 and Agent 2 are presented with the devastating news: the foreclosure of their prized property. The once-thriving real estate market is now in shambles, and their clients are beginning to lose faith. Agent 1 proposes a radical restructuring of the company, one that would involve drastic layoffs and a complete overhaul of their marketing strategy. Agent 2 suggests a phased approach, one that would involve careful analysis and gradual changes to the company's operations. The two agents are at odds, their differing personalities and approaches threatening to tear the company apart.\n\nAct 2: The Conflict\nAs the crisis deepens, Agent 1 and Agent 2 find themselves at odds over their approach to the crisis. Agent 1 sees the foreclosure as an opportunity to take bold action, to make a statement and demonstrate their commitment to their clients. Agent 2, on the other hand, sees it as a chance to reassess their strategy and find a more sustainable solution. The two agents are at loggerheads, their conflicting personalities and approaches threatening to derail the entire operation.\n\nAct 3: The Resolution\nIn the final act, Agent 1 and Agent 2 must find a way to put aside their differences and work together to salvage their company. They realize that their differing approaches are not mutually exclusive, but rather complementary. Agent 1's boldness and creativity can be combined with Agent 2's analytical mind and attention to detail to create a winning strategy. The two agents put aside their egos and work together, leveraging their strengths to find a solution that saves their company and restores order to the market.",Save Green Valley Realty from bankruptcy and restore the trust of their clients.,To be recognized as a visionary leader who can turn the company around through bold and innovative decisions.,To protect the company's reputation and assets by implementing a data-driven and strategic approach to crisis management.
Planning a Political Rally,Politics,Donald Trump,Arnold Schwarzenegger,"{ ""Openness"": 3, ""Conscientiousness"": 4, ""Agreeableness"": 2, ""Extroversion"": 5, ""Neuroticism"": 4 }","{ ""Openness"": 3, ""Conscientiousness"": 4, ""Agreeableness"": 4, ""Extroversion"": 5, ""Neuroticism"": 2 }","The scenario takes place on a hot summer day, in a busy metropolitan city, where Agent 1 and Agent 2 are part of a political party that aims to host a massive rally to boost their campaign for the upcoming election. However, tensions rise when a severe storm warning is issued, threatening to disrupt the event.\n\nThe city is plagued by recent drought and heatwaves, causing widespread discontent among the citizens, and the party is struggling to keep their voters' trust.\n\nAgent 1 is a detail-oriented, Type-A personality, who emphasizes order and structure. They are fiercely loyal to the party and its vision, but often struggle with adapting to uncertainty and spontaneity.\n\nAgent 2 is an outgoing, charismatic individual, with a background in public relations. They prioritize building relationships and finding common ground with others, often at the expense of long-term planning and compromise.\n\nThe shared goal of the agents is to host a successful rally, which will bring in much-needed funds and publicity for the party. Their personal goals are at odds, however, as Agent 1 aims to stick to the original plan, while Agent 2 wants to adjust the event to appeal to a broader audience.",host a successful rally,stick to the original plan,adjust the event to appeal to a broader audience
