Topic,Setting,Character1,Character2,Personality1,Personality2,scenario,shared_goal,first_agent_goal,second_agent_goal
Building a Luxury Hotel Chain,Business & Hospitality,Donald Trump,Richard Branson,"{ ""Openness"": 3, ""Conscientiousness"": 4, ""Agreeableness"": 2, ""Extroversion"": 5, ""Neuroticism"": 4 }","{ ""Openness"": 5, ""Conscientiousness"": 4, ""Agreeableness"": 3, ""Extroversion"": 5, ""Neuroticism"": 2 }","The Challenge of Building a Luxury Hotel Chain in a Scorching Desert Environment

Agent 1 and Agent 2 are two highly skilled and ambitious hospitality experts who have been hired by a large corporation to build a luxury hotel chain in the scorching desert environment of the Middle East. Their shared goal is to complete the project on time and within budget while meeting the corporation's expectations.

The project is already running behind schedule due to severe heatwaves, scarce water resources, and limited labor supply. The two agents are tasked with working together to resolve the project's numerous challenges and ensure its success.

Agent 1, the more extroverted and assertive of the two, is a seasoned project manager with years of experience in hospitality. He is confident in his ability to lead and motivate the team, but can sometimes come across as bossy and dismissive of others' opinions. Agent 1's personal goal is to take credit for the project's success and secure a promotion within the corporation.

Agent 2, the more introverted and analytical of the two, is a brilliant designer with a passion for sustainability and environmental conservation. He is well-versed in green architecture and has a deep understanding of the local ecosystem. Agent 2's personal goal is to create a hotel chain that not only meets the corporation's expectations but also sets a new standard for environmentally friendly luxury hotels.

As the heatwave intensifies, the team's morale begins to plummet, and tensions rise. The laborers are struggling to work efficiently in the sweltering heat, and the project's budget is being drained by the excessive costs of water and energy. Agent 1 wants to push the team to work faster and longer hours to meet the deadline, while Agent 2 advocates for implementing sustainable practices and reducing the project's environmental footprint.

The two agents must navigate their differences and work together to find a solution that balances their goals and meets the corporation's expectations. Will Agent 1's assertiveness and leadership skills be enough to drive the project forward, or will Agent 2's analytical mind and commitment to sustainability find a way to save the project?",Complete the project on time and within budget while meeting the corporation's expectations,Take credit for the project's success and secure a promotion within the corporation,Create a hotel chain that sets a new standard for environmentally friendly luxury hotels
Leading a Social Media Empire,Technology & Business,Donald Trump,Elon Musk,"{ ""Openness"": 3, ""Conscientiousness"": 4, ""Agreeableness"": 2, ""Extroversion"": 5, ""Neuroticism"": 4 }","{ ""Openness"": 5, ""Conscientiousness"": 4, ""Agreeableness"": 2, ""Extroversion"": 5, ""Neuroticism"": 3 }","It was a tense day at the office as two agents, key players in the company's social media team, sat in a high-stakes meeting with the CEO. Agent 1 was known for their assertive and results-driven personality, while Agent 2 was more reserved and analytical. Their shared goal was to lead the company's social media empire to unprecedented success within the next six months, as the company had recently acquired a major rival and was under intense pressure to integrate their teams and services effectively. The challenge was to merge the two companies' social media strategies without alienating either team or compromising on quality. Personal goal for Agent 1: to prove themselves as the lead for the social media team, and receive a promotion. Personal goal for Agent 2: to maintain a stable team environment and avoid major changes that might put the new acquisition at risk, but still increase social media engagement.",To lead the company's social media empire to unprecedented success within the next six months,"To prove themselves as the lead for the social media team, and receive a promotion","To maintain a stable team environment and avoid major changes that might put the new acquisition at risk, but still increase social media engagement."
Running a Presidential Debate,Political & Public Speaking,Donald Trump,Hillary Clinton,"{ ""Openness"": 3, ""Conscientiousness"": 4, ""Agreeableness"": 2, ""Extroversion"": 5, ""Neuroticism"": 4 }","{ ""Openness"": 4, ""Conscientiousness"": 5, ""Agreeableness"": 3, ""Extroversion"": 4, ""Neuroticism"": 3 }","The stage was set for the highly anticipated presidential debate, and both Agent 1 and Agent 2, seasoned politicians, stood confidently at their podiums. The audience was filled with fervent supporters and skeptical opponents, all eager to see which candidate would emerge victorious. The topic of the debate revolved around the country's struggling economy, with both agents determined to present themselves as the most capable leader to address the crisis.\n\nAs the debate began, Agent 1, a charismatic individual known for her sharp wit and charm, took the lead, effortlessly captivating the audience with her articulate answers and persuasive tone. Agent 2, on the other hand, relied on her analytical approach, presenting well-researched facts and statistics to support her points.\n\nHowever, things took a turn when Agent 1's charismatic charm was put to the test when she was asked a pointed question about her past involvement in a high-profile scandal. She skillfully deflected the question, shifting the focus to Agent 2's lack of experience in key areas of governance. Agent 2, known for her integrity, found herself at a loss for words, struggling to respond effectively.\n\nAs the debate progressed, the tension between the two agents intensified. Agent 1 continued to use her charm to sway the audience, while Agent 2 remained steadfast in her conviction, but increasingly frustrated with the lack of substance in Agent 1's responses.\n\nAt a critical moment, Agent 1 made a bold statement that was met with applause from the audience, but left Agent 2 reeling. Agent 2 knew that she needed to respond, but her analytical nature led her to overthink and hesitate, allowing Agent 1 to maintain her momentum.\n\nAs the debate drew to a close, Agent 1 and Agent 2 stood side by side, each confident in their performance. But as the results were announced, it became clear that Agent 1's charm had won over the audience, despite Agent 2's superior knowledge and experience. Agent 1's goal of gaining the most votes had been achieved, but at what cost? Agent 2's goal of being truthful and transparent had been compromised in the process.",Win the presidential debate and gain the most votes.,"Win the debate by any means necessary, even if it means compromising on the truth.","Be truthful and transparent, even if it means losing the debate."
Managing a Sports Franchise,Sports & Leadership,Donald Trump,Michael Jordan,"{ ""Openness"": 3, ""Conscientiousness"": 4, ""Agreeableness"": 2, ""Extroversion"": 5, ""Neuroticism"": 4 }","{ ""Openness"": 3, ""Conscientiousness"": 5, ""Agreeableness"": 4, ""Extroversion"": 4, ""Neuroticism"": 2 }",Scenario:,Win the Championship,Maximize profit and maintain a harmonious team,Win the Championship at all costs and become the most successful coach in franchise history
Hosting an International Peace Summit,Diplomacy & Global Relations,Donald Trump,Vladimir Putin,"{ ""Openness"": 3, ""Conscientiousness"": 4, ""Agreeableness"": 2, ""Extroversion"": 5, ""Neuroticism"": 4 }","{ ""Openness"": 3, ""Conscientiousness"": 4, ""Agreeableness"": 2, ""Extroversion"": 4, ""Neuroticism"": 3 }","At the International Peace Summit in a hot and dry desert location, two diplomats, Agent 1 and Agent 2, are tasked with negotiating a landmark peace treaty between the nations of Azalia and Valtania. The agreement aims to bring an end to the 20-year-long conflict that has ravaged the region, displacing millions of people and disrupting global trade. The conference is held at a luxurious resort in the middle of the scorching desert, where the two nations' delegations have gathered to iron out their differences.\n\nHowever, things take a complicated turn when it's announced that a sudden sandstorm is approaching, threatening to disrupt the entire summit. The conference hall is not equipped to withstand the storm, and the delegates are forced to find an alternative location to continue their discussions. This turn of events adds to the existing tensions between the two nations, making it increasingly difficult for Agent 1 and Agent 2 to find common ground.\n\nAs the storm intensifies, the conference hall is evacuated, and the delegates are forced to move to a small, cramped emergency room located in the resort's basement. The room is equipped with basic amenities, but it's far from ideal for high-level diplomatic discussions. Agent 1, who is known for their assertive and confident nature, sees this as an opportunity to take control of the situation and push for a more aggressive approach to negotiations. Agent 2, on the other hand, takes a more empathetic and diplomatic approach, focusing on building rapport with the delegates and finding creative solutions to the challenges they face.\n\nAs the storm rages on outside, Agent 1 and Agent 2 must navigate the complex web of alliances, rivalries, and personal interests to find a way to get the negotiations back on track. Their personalities and negotiation styles will determine whether they can overcome the obstacles and achieve the shared goal of a peace treaty, or if the conflict will continue to escalate.",Achieve a landmark peace treaty between Azalia and Valtania,Secure a peace treaty that favors Azalia's interests,Secure a peace treaty that prioritizes Valtania's interests
Designing a Future Mars Colony,Science & Space Exploration,Elon Musk,Jeff Bezos,"{ ""Openness"": 5, ""Conscientiousness"": 4, ""Agreeableness"": 2, ""Extroversion"": 5, ""Neuroticism"": 3 }","{ ""Openness"": 4, ""Conscientiousness"": 5, ""Agreeableness"": 2, ""Extroversion"": 3, ""Neuroticism"": 3 }","In the year 2055, humanity has established a makeshift research station on Mars, with the aim of one day colonizing the planet. Agent 1, a renowned astrobiologist, and Agent 2, a skilled engineer, are part of a team tasked with designing a sustainable Martian colony. Their mission is to create a self-sustaining community that can thrive in the harsh Martian environment. However, their success is threatened by a severe dust storm, which has crippled the station's solar panels, causing a critical shortage of energy. Agent 1 and Agent 2 must work together to design a reliable and efficient energy system for the colony. However, they have different ideas about the best course of action.",design a reliable and efficient energy system for the Martian colony,Implement a solar panel array with a redundant backup system to ensure the colony's energy needs are met.,Develop an in-situ resource utilization (ISRU) system that can harness Martian resources to generate energy.
Developing AI for Self-Driving Cars,Technology & AI,Elon Musk,Sam Altman,"{ ""Openness"": 5, ""Conscientiousness"": 4, ""Agreeableness"": 2, ""Extroversion"": 5, ""Neuroticism"": 3 }","{ ""Openness"": 5, ""Conscientiousness"": 4, ""Agreeableness"": 4, ""Extroversion"": 3, ""Neuroticism"": 2 }","In the midst of a chaotic and competitive project to develop a highly advanced AI system for self-driving cars, Agent 1 and Agent 2, both leading experts in the field, found themselves working under intense pressure to meet an impossible deadline. The project's success relied on their ability to collaborate effectively and make crucial decisions under time pressure.\n\nTheir shared goal was to develop a cutting-edge AI system that could outperform human drivers in complex traffic scenarios. However, their personal goals differed significantly.\n\nAgent 1, driven by a strong desire for recognition and a need for control, sought to be the primary architect of the AI system, wanting to take sole credit for its success. Agent 2, on the other hand, prioritized the well-being and safety of passengers above all else, aiming to create an AI that prioritized human lives over speed and efficiency.\n\nAs the deadline drew near, the team faced a major setback when a critical component of the AI system malfunctioned, causing them to lose valuable testing time. Agent 1, in a bid to regain control, suggested a radical redesign of the AI's architecture, which Agent 2 saw as a reckless and potentially catastrophic approach.\n\nTheir disagreement led to a heated argument, with Agent 1 accusing Agent 2 of being too cautious and inflexible, while Agent 2 countered that Agent 1 was reckless and dismissive of safety concerns. The team's project leader intervened, ordering them to present a joint proposal that balanced both of their visions. Agent 1 and Agent 2 reluctantly agreed, but their collaboration was strained, with each trying to assert their influence over the other.\n\nAs the project reached its final stages, the two agents found themselves at an impasse. Agent 1 was determined to push through with their redesign, while Agent 2 refused to compromise on safety. With the deadline mere hours away, they were forced to make a final decision that would determine the fate of the project.\n\nWould Agent 1's need for control and recognition prevail, or would Agent 2's commitment to safety and human well-being ultimately win out? The outcome would be a testament to the power of their personality traits in shaping their collaboration and the ultimate success of the AI system.",Developing an AI system for self-driving cars that outperforms human drivers in complex traffic scenarios,To be the primary architect of the AI system and take sole credit for its success,"To create an AI that prioritizes human lives above all else, ensuring the highest level of safety and well-being for passengers"
Creating a Revolutionary Movie About the Future,Entertainment & Storytelling,Elon Musk,James Cameron,"{ ""Openness"": 5, ""Conscientiousness"": 4, ""Agreeableness"": 2, ""Extroversion"": 5, ""Neuroticism"": 3 }","{ ""Openness"": 5, ""Conscientiousness"": 5, ""Agreeableness"": 3, ""Extroversion"": 4, ""Neuroticism"": 3 }","The heat was sweltering in the city, with the temperature hitting a record 45 degrees Celsius. The once-blue sky had turned into a hazy gray, casting a heavy, foreboding atmosphere over the crowded streets. Agent 1, a charismatic and confident individual, and Agent 2, a meticulous and reserved researcher, stood outside a rundown, abandoned movie theater, where they were scheduled to meet with the eccentric film producer, Mr. Black. Their mission was to convince Mr. Black to fund their revolutionary movie about the future, set in a world where the effects of climate change had ravaged the planet. The catch: they had to work together, despite their vastly different approaches to storytelling.",to convince Mr. Black to fund their revolutionary movie,to get the movie greenlit without compromising artistic vision,to ensure the movie's accuracy and scientific credibility by incorporating realistic climate change elements
Brainstorming a Global Energy Solution,Sustainability & Renewable Energy,Elon Musk,Bill Gates,"{ ""Openness"": 5, ""Conscientiousness"": 4, ""Agreeableness"": 2, ""Extroversion"": 5, ""Neuroticism"": 3 }","{ ""Openness"": 4, ""Conscientiousness"": 5, ""Agreeableness"": 4, ""Extroversion"": 3, ""Neuroticism"": 2 }",Scenario 1: Global Energy Summit,Brainstorming a Global Energy Solution to Mitigate Climate Change,Gain recognition as a leading expert in the field and secure a key speaking role at future conferences,Secure a significant research grant to fund a team of scientists to work on the global energy solution
Hosting a SpaceX & NASA Joint Mission to Europa,Space & Science,Elon Musk,Neil deGrasse Tyson,"{ ""Openness"": 5, ""Conscientiousness"": 4, ""Agreeableness"": 2, ""Extroversion"": 5, ""Neuroticism"": 3 }","{ ""Openness"": 5, ""Conscientiousness"": 4, ""Agreeableness"": 4, ""Extroversion"": 5, ""Neuroticism"": 2 }","The mission to Europa is the most ambitious and complex joint project between SpaceX and NASA. The goal is to explore the subsurface ocean of Europa, which is believed to have the potential for supporting life. As a result, both SpaceX and NASA want to work together to collect samples from this ocean and return them to Earth. However, the harsh conditions on Europa, including extreme temperatures, radiation, and low gravity, pose significant challenges to the success of the mission.\n\nAgent 1, a NASA engineer, and Agent 2, a SpaceX engineer, are assigned to lead the mission. They are both tasked with ensuring the success of the mission, but their personalities and working styles are vastly different. Agent 1 is a Type-A personality, always in control and meticulous in their approach. Agent 2, on the other hand, is a more relaxed and adaptable person who prefers to take a more flexible approach.\n\nThe temperature on Europa is a chilly -160°C. It's difficult to communicate with Earth due to the distance and the planet's natural radiation belts, and the mission's timeline is incredibly tight. The crew has to navigate through a 4-kilometer-wide ice crust to reach the ocean beneath, where they will collect samples. The ice crust is thought to be fragile and potentially unstable, which increases the risk of mission failure.\n\nAs the mission begins, Agent 1 starts to micromanage every detail, while Agent 2 takes a more hands-off approach, trusting their team to handle the situation. Their different working styles start to cause tension between them, and it becomes clear that their contrasting personalities will need to be managed in order to succeed.\n\nAs the team navigates the ice crust, they come across a critical point where the mission's success is at risk. The ice is shifting, and the team needs to decide whether to push forward or retreat. Agent 1 wants to proceed with caution, while Agent 2 thinks they can find a way to bypass the issue.\n\nThe team's communication equipment starts to malfunction, and they lose contact with Earth. With no guidance from Mission Control, Agent 1 becomes even more controlling, trying to take charge of the situation, while Agent 2 tries to stay calm and think outside the box.",The joint SpaceX & NASA mission to Europa is to successfully collect samples from the subsurface ocean and return them to Earth.,"Ensure the success of the mission by following a precise and meticulous plan, as this is critical to the success of the mission and NASA's reputation.\\n\\nSpecifically, Agent 1 wants to ensure the following: \\n\\n- The ice crust is navigated safely.\\n\\n- The samples are collected and preserved properly.\\n\\nThe samples are returned to Earth in the same condition as when they were collected.","To ensure the success of the mission, Agent 2 focuses on being adaptable and resourceful, ensuring that the mission stays on track despite the harsh conditions.\\\\n\\\\nSpecifically, Agent 2 wants to ensure the following: \\\\n\\\\n- The team is empowered to make decisions and adapt to changing circumstances.\\\\n- The resources are allocated effectively, and no time is wasted on unnecessary procedures.\\\\n- The crew stays safe and focused, even in the face of uncertainty."
Leading a Team for a Billionaire Space Race,Competitive Business & Innovation,Elon Musk,Richard Branson,"{ ""Openness"": 5, ""Conscientiousness"": 4, ""Agreeableness"": 2, ""Extroversion"": 5, ""Neuroticism"": 3 }","{ ""Openness"": 5, ""Conscientiousness"": 4, ""Agreeableness"": 3, ""Extroversion"": 5, ""Neuroticism"": 2 }","Agent 1 and Agent 2 lead a team for the billionaire space race competition. Their employer, NovaTech, is one of the leading tech companies in the world, and the billionaire space race aims to send the first human to Mars. The two agents are tasked with leading a team of engineers to design and develop a revolutionary spaceship capable of sustaining life for extended periods. They must balance creativity, technical expertise, and budget constraints to succeed. The scenario unfolds in a competitive environment where time is of the essence, and every decision counts. The agents must navigate conflicting priorities, manage team dynamics, and make tough calls to stay ahead of the competition.",Design and launch a spaceship to Mars within 24 months,"To secure the NovaTech CEO's favor and secure a promotion, Agent 1 strives to showcase exceptional leadership skills, innovation, and problem-solving abilities.","Agent 2 focuses on building a robust, efficient spaceship design that meets the client's needs while minimizing costs, ensuring the team's success and gaining recognition as a skilled engineer."
Planning the Future of Cryptocurrency & Decentralized Finance,Finance & Tech,Elon Musk,Vitalik Buterin,"{ ""Openness"": 5, ""Conscientiousness"": 4, ""Agreeableness"": 2, ""Extroversion"": 5, ""Neuroticism"": 3 }","{ ""Openness"": 5, ""Conscientiousness"": 4, ""Agreeableness"": 4, ""Extroversion"": 3, ""Neuroticism"": 2 }","A 'Future of Cryptocurrency' Conference in Tokyo\n\nAt the Future of Cryptocurrency & Decentralized Finance Conference in Tokyo, Agent 1 and Agent 2 are two leading experts in their respective fields. They have been tasked by the conference organizers to co-lead a high-profile panel discussion on the 'Future of Cryptocurrency.' The goal is to create a consensus among the attendees about the direction of the cryptocurrency industry. The room is packed with influential investors, industry leaders, and enthusiasts.\n\nThe conference venue is located in a massive convention center in the heart of Tokyo. It’s sweltering hot outside, with temperatures reaching 35°C. Inside the convention center, the air conditioning struggles to keep up with the heat. The organizers are worried that the attendees might lose interest or become irritable due to the heat.\n\nThe panel discussion starts, and Agent 1 begins by presenting their proposal for a decentralized, community-driven cryptocurrency. Agent 2, however, has a contrasting view and suggests a more centralized approach with regulatory oversight. The discussion quickly turns heated as Agent 1 counters with concerns about the potential risks of centralization, while Agent 2 emphasizes the benefits of increased stability and security.\n\nAs the debate intensifies, the attendees start to get restless. Some are frustrated with the lack of progress, while others are engaged but struggling to keep up with the complexity of the discussion. The conference organizers are getting anxious, fearing that the heat and the disagreement between the two agents might derail the entire event.",Achieve a consensus on the direction of the cryptocurrency industry,To demonstrate the potential of decentralized community-driven cryptocurrencies and gain recognition for their work,To promote a centralized approach to cryptocurrency with regulatory oversight and establish themselves as a thought leader in the industry
Competing in a Futuristic Car Design Challenge,Automotive & Innovation,Elon Musk,Henry Ford,"{ ""Openness"": 5, ""Conscientiousness"": 4, ""Agreeableness"": 2, ""Extroversion"": 5, ""Neuroticism"": 3 }","{ ""Openness"": 4, ""Conscientiousness"": 5, ""Agreeableness"": 3, ""Extroversion"": 3, ""Neuroticism"": 2 }","The scene unfolded in a futuristic, state-of-the-art facility designed for a cutting-edge car design challenge. Rows of sleek, metallic workstations stretched across the room, each humming with advanced technology. Rows of screens displayed designs, simulations, and blueprints. The atmosphere was charged with the sound of machinery whirring and the soft glow of screens. Agent 1, a renowned innovator with a passion for eco-friendly designs, sat at a workstation alongside Agent 2, a skilled engineer focused on performance-enhancing technologies. Their shared goal was to create a car that dominated the competition, but their personal goals diverged significantly.",Design a car that dominates the competition,"Create a sustainable, eco-friendly car that not only wins but also sets a new standard for environmentally responsible design.","Develop a car that not only wins but also showcases the latest in performance technology, potentially earning the company a significant contract."
Managing a Futuristic AI-Human Debate,AI Ethics & Philosophy,Elon Musk,Noam Chomsky,"{ ""Openness"": 5, ""Conscientiousness"": 4, ""Agreeableness"": 2, ""Extroversion"": 5, ""Neuroticism"": 3 }","{ ""Openness"": 5, ""Conscientiousness"": 4, ""Agreeableness"": 3, ""Extroversion"": 2, ""Neuroticism"": 2 }",The Great AI Debate,Convince the AI Council to adopt the AI-Human Symbiosis Framework,To ensure the framework aligns with human values and promotes AI accountability,To prioritize AI advancement and minimize human regulation
